 Resolving package versions...
 Installed Tables ────────────────────── v0.2.11
 Installed Mustache ──────────────────── v0.5.13
 Installed DataAPI ───────────────────── v1.1.0
 Installed URIParser ─────────────────── v0.4.0
 Installed DataValueInterfaces ───────── v1.0.0
 Installed TableTraits ───────────────── v1.0.0
 Installed IteratorInterfaceExtensions ─ v1.0.0
 Installed PkgTemplates ──────────────── v0.6.3
  Updating `~/.julia/environments/v1.4/Project.toml`
  [14b8a8f1] + PkgTemplates v0.6.3
  Updating `~/.julia/environments/v1.4/Manifest.toml`
  [9a962f9c] + DataAPI v1.1.0
  [e2d170a0] + DataValueInterfaces v1.0.0
  [82899510] + IteratorInterfaceExtensions v1.0.0
  [ffc61752] + Mustache v0.5.13
  [14b8a8f1] + PkgTemplates v0.6.3
  [3783bdb8] + TableTraits v1.0.0
  [bd369af6] + Tables v0.2.11
  [30578b45] + URIParser v0.4.0
  [2a0f44e3] + Base64 
  [ade2ca70] + Dates 
  [8ba89e20] + Distributed 
  [b77e0a4c] + InteractiveUtils 
  [76f85450] + LibGit2 
  [8f399da3] + Libdl 
  [37e2e46d] + LinearAlgebra 
  [56ddb016] + Logging 
  [d6f4376e] + Markdown 
  [44cfe95a] + Pkg 
  [de0858da] + Printf 
  [3fa0cd96] + REPL 
  [9a3f8284] + Random 
  [ea8e919c] + SHA 
  [9e88b42a] + Serialization 
  [6462fe0b] + Sockets 
  [8dfed614] + Test 
  [cf7118a7] + UUIDs 
  [4ec0a83e] + Unicode 
   Testing PkgTemplates
 Resolving package versions...
Status `/tmp/jl_GtFPQl/Manifest.toml`
  [9a962f9c] DataAPI v1.1.0
  [e2d170a0] DataValueInterfaces v1.0.0
  [82899510] IteratorInterfaceExtensions v1.0.0
  [ffc61752] Mustache v0.5.13
  [14b8a8f1] PkgTemplates v0.6.3
  [3783bdb8] TableTraits v1.0.0
  [bd369af6] Tables v0.2.11
  [30578b45] URIParser v0.4.0
  [2a0f44e3] Base64  [`@stdlib/Base64`]
  [ade2ca70] Dates  [`@stdlib/Dates`]
  [8ba89e20] Distributed  [`@stdlib/Distributed`]
  [b77e0a4c] InteractiveUtils  [`@stdlib/InteractiveUtils`]
  [76f85450] LibGit2  [`@stdlib/LibGit2`]
  [8f399da3] Libdl  [`@stdlib/Libdl`]
  [37e2e46d] LinearAlgebra  [`@stdlib/LinearAlgebra`]
  [56ddb016] Logging  [`@stdlib/Logging`]
  [d6f4376e] Markdown  [`@stdlib/Markdown`]
  [44cfe95a] Pkg  [`@stdlib/Pkg`]
  [de0858da] Printf  [`@stdlib/Printf`]
  [3fa0cd96] REPL  [`@stdlib/REPL`]
  [9a3f8284] Random  [`@stdlib/Random`]
  [ea8e919c] SHA  [`@stdlib/SHA`]
  [9e88b42a] Serialization  [`@stdlib/Serialization`]
  [6462fe0b] Sockets  [`@stdlib/Sockets`]
  [8dfed614] Test  [`@stdlib/Test`]
  [cf7118a7] UUIDs  [`@stdlib/UUIDs`]
  [4ec0a83e] Unicode  [`@stdlib/Unicode`]
┌ Warning: Git config option 'user.name' missing, package generation will fail unless you supply a GitConfig
└ @ PkgTemplates ~/.julia/packages/PkgTemplates/DXe8J/src/template.jl:242
┌ Warning: Git config option 'user.email' missing, package generation will fail unless you supply a GitConfig
└ @ PkgTemplates ~/.julia/packages/PkgTemplates/DXe8J/src/template.jl:242
┌ Warning: Git config option 'user.name' missing, package generation will fail unless you supply a GitConfig
└ @ PkgTemplates ~/.julia/packages/PkgTemplates/DXe8J/src/template.jl:242
┌ Warning: Git config option 'user.email' missing, package generation will fail unless you supply a GitConfig
└ @ PkgTemplates ~/.julia/packages/PkgTemplates/DXe8J/src/template.jl:242
┌ Warning: Git config option 'user.name' missing, package generation will fail unless you supply a GitConfig
└ @ PkgTemplates ~/.julia/packages/PkgTemplates/DXe8J/src/template.jl:242
┌ Warning: Git config option 'user.email' missing, package generation will fail unless you supply a GitConfig
└ @ PkgTemplates ~/.julia/packages/PkgTemplates/DXe8J/src/template.jl:242
┌ Warning: Git config option 'user.name' missing, package generation will fail unless you supply a GitConfig
└ @ PkgTemplates ~/.julia/packages/PkgTemplates/DXe8J/src/template.jl:242
┌ Warning: Git config option 'user.email' missing, package generation will fail unless you supply a GitConfig
└ @ PkgTemplates ~/.julia/packages/PkgTemplates/DXe8J/src/template.jl:242
┌ Warning: Git config option 'user.name' missing, package generation will fail unless you supply a GitConfig
└ @ PkgTemplates ~/.julia/packages/PkgTemplates/DXe8J/src/template.jl:242
┌ Warning: Git config option 'user.email' missing, package generation will fail unless you supply a GitConfig
└ @ PkgTemplates ~/.julia/packages/PkgTemplates/DXe8J/src/template.jl:242
┌ Warning: Git config option 'user.name' missing, package generation will fail unless you supply a GitConfig
└ @ PkgTemplates ~/.julia/packages/PkgTemplates/DXe8J/src/template.jl:242
┌ Warning: Git config option 'user.email' missing, package generation will fail unless you supply a GitConfig
└ @ PkgTemplates ~/.julia/packages/PkgTemplates/DXe8J/src/template.jl:242
┌ Warning: Git config option 'user.name' missing, package generation will fail unless you supply a GitConfig
└ @ PkgTemplates ~/.julia/packages/PkgTemplates/DXe8J/src/template.jl:242
┌ Warning: Git config option 'user.email' missing, package generation will fail unless you supply a GitConfig
└ @ PkgTemplates ~/.julia/packages/PkgTemplates/DXe8J/src/template.jl:242
┌ Warning: Git config option 'user.name' missing, package generation will fail unless you supply a GitConfig
└ @ PkgTemplates ~/.julia/packages/PkgTemplates/DXe8J/src/template.jl:242
┌ Warning: Git config option 'user.email' missing, package generation will fail unless you supply a GitConfig
└ @ PkgTemplates ~/.julia/packages/PkgTemplates/DXe8J/src/template.jl:242
┌ Warning: Git config option 'user.name' missing, package generation will fail unless you supply a GitConfig
└ @ PkgTemplates ~/.julia/packages/PkgTemplates/DXe8J/src/template.jl:242
┌ Warning: Git config option 'user.email' missing, package generation will fail unless you supply a GitConfig
└ @ PkgTemplates ~/.julia/packages/PkgTemplates/DXe8J/src/template.jl:242
┌ Warning: Git config option 'user.name' missing, package generation will fail unless you supply a GitConfig
└ @ PkgTemplates ~/.julia/packages/PkgTemplates/DXe8J/src/template.jl:242
┌ Warning: Git config option 'user.email' missing, package generation will fail unless you supply a GitConfig
└ @ PkgTemplates ~/.julia/packages/PkgTemplates/DXe8J/src/template.jl:242
┌ Warning: Git config option 'user.name' missing, package generation will fail unless you supply a GitConfig
└ @ PkgTemplates ~/.julia/packages/PkgTemplates/DXe8J/src/template.jl:242
┌ Warning: Git config option 'user.email' missing, package generation will fail unless you supply a GitConfig
└ @ PkgTemplates ~/.julia/packages/PkgTemplates/DXe8J/src/template.jl:242
┌ Warning: Git config option 'user.name' missing, package generation will fail unless you supply a GitConfig
└ @ PkgTemplates ~/.julia/packages/PkgTemplates/DXe8J/src/template.jl:242
┌ Warning: Git config option 'user.email' missing, package generation will fail unless you supply a GitConfig
└ @ PkgTemplates ~/.julia/packages/PkgTemplates/DXe8J/src/template.jl:242
┌ Warning: Git config option 'user.name' missing, package generation will fail unless you supply a GitConfig
└ @ PkgTemplates ~/.julia/packages/PkgTemplates/DXe8J/src/template.jl:242
┌ Warning: Git config option 'user.email' missing, package generation will fail unless you supply a GitConfig
└ @ PkgTemplates ~/.julia/packages/PkgTemplates/DXe8J/src/template.jl:242
┌ Warning: Git config option 'user.name' missing, package generation will fail unless you supply a GitConfig
└ @ PkgTemplates ~/.julia/packages/PkgTemplates/DXe8J/src/template.jl:242
┌ Warning: Git config option 'user.email' missing, package generation will fail unless you supply a GitConfig
└ @ PkgTemplates ~/.julia/packages/PkgTemplates/DXe8J/src/template.jl:242
┌ Warning: Git config option 'user.name' missing, package generation will fail unless you supply a GitConfig
└ @ PkgTemplates ~/.julia/packages/PkgTemplates/DXe8J/src/template.jl:242
┌ Warning: Git config option 'user.email' missing, package generation will fail unless you supply a GitConfig
└ @ PkgTemplates ~/.julia/packages/PkgTemplates/DXe8J/src/template.jl:242
┌ Warning: Git config option 'user.name' missing, package generation will fail unless you supply a GitConfig
└ @ PkgTemplates ~/.julia/packages/PkgTemplates/DXe8J/src/template.jl:242
┌ Warning: Git config option 'user.email' missing, package generation will fail unless you supply a GitConfig
└ @ PkgTemplates ~/.julia/packages/PkgTemplates/DXe8J/src/template.jl:242
┌ Warning: Git config option 'user.name' missing, package generation will fail unless you supply a GitConfig
└ @ PkgTemplates ~/.julia/packages/PkgTemplates/DXe8J/src/template.jl:242
┌ Warning: Git config option 'user.email' missing, package generation will fail unless you supply a GitConfig
└ @ PkgTemplates ~/.julia/packages/PkgTemplates/DXe8J/src/template.jl:242
Activating new environment at `/tmp/jl_lJDhBB/TestPkg/Project.toml`
 Resolving package versions...
  Updating `/tmp/jl_lJDhBB/TestPkg/Project.toml`
  [8dfed614] + Test 
  Updating `/tmp/jl_lJDhBB/TestPkg/Manifest.toml`
  [2a0f44e3] + Base64 
  [8ba89e20] + Distributed 
  [b77e0a4c] + InteractiveUtils 
  [56ddb016] + Logging 
  [d6f4376e] + Markdown 
  [9a3f8284] + Random 
  [9e88b42a] + Serialization 
  [6462fe0b] + Sockets 
  [8dfed614] + Test 
  Updating `/tmp/jl_lJDhBB/TestPkg/Project.toml`
 [no changes]
  Updating `/tmp/jl_lJDhBB/TestPkg/Manifest.toml`
  [2a0f44e3] - Base64 
  [8ba89e20] - Distributed 
  [b77e0a4c] - InteractiveUtils 
  [56ddb016] - Logging 
  [d6f4376e] - Markdown 
  [9a3f8284] - Random 
  [9e88b42a] - Serialization 
  [6462fe0b] - Sockets 
  [8dfed614] - Test 
Activating environment at `/tmp/jl_GtFPQl/Project.toml`
┌ Warning: Git config option 'user.name' missing, package generation will fail unless you supply a GitConfig
└ @ PkgTemplates ~/.julia/packages/PkgTemplates/DXe8J/src/template.jl:242
┌ Warning: Git config option 'user.email' missing, package generation will fail unless you supply a GitConfig
└ @ PkgTemplates ~/.julia/packages/PkgTemplates/DXe8J/src/template.jl:242
Generating  project TestPkg:
    /tmp/jl_txRiqq/dev/TestPkg/Project.toml
    /tmp/jl_txRiqq/dev/TestPkg/src/TestPkg.jl
[ Info: Initialized Git repo at /tmp/jl_txRiqq/dev/TestPkg
[ Info: Set remote origin to https://github.com/christopher-dG/TestPkg.jl
Activating environment at `/tmp/jl_txRiqq/dev/TestPkg/Project.toml`
 Resolving package versions...
  Updating `/tmp/jl_txRiqq/dev/TestPkg/Project.toml`
  [8dfed614] + Test 
  Updating `/tmp/jl_txRiqq/dev/TestPkg/Manifest.toml`
  [2a0f44e3] + Base64 
  [8ba89e20] + Distributed 
  [b77e0a4c] + InteractiveUtils 
  [56ddb016] + Logging 
  [d6f4376e] + Markdown 
  [9a3f8284] + Random 
  [9e88b42a] + Serialization 
  [6462fe0b] + Sockets 
  [8dfed614] + Test 
  Updating `/tmp/jl_txRiqq/dev/TestPkg/Project.toml`
 [no changes]
  Updating `/tmp/jl_txRiqq/dev/TestPkg/Manifest.toml`
  [2a0f44e3] - Base64 
  [8ba89e20] - Distributed 
  [b77e0a4c] - InteractiveUtils 
  [56ddb016] - Logging 
  [d6f4376e] - Markdown 
  [9a3f8284] - Random 
  [9e88b42a] - Serialization 
  [6462fe0b] - Sockets 
  [8dfed614] - Test 
Activating environment at `/tmp/jl_GtFPQl/Project.toml`
[ Info: Committed 6 files/directories: src/, Project.toml, test/, README.md, LICENSE, .gitignore
Path `/tmp/jl_txRiqq/dev/TestPkg` exists and looks like the correct package. Using existing path.
  Updating `/tmp/jl_GtFPQl/Project.toml`
  [bd327738] + TestPkg v0.1.0 [`/tmp/jl_txRiqq/dev/TestPkg`]
  Updating `/tmp/jl_GtFPQl/Manifest.toml`
  [bd327738] + TestPkg v0.1.0 [`/tmp/jl_txRiqq/dev/TestPkg`]
  [2a0f44e3] ~ Base64  [`@stdlib/Base64`] ⇒ 
  [8ba89e20] ~ Distributed  [`@stdlib/Distributed`] ⇒ 
  [8f399da3] ~ Libdl  [`@stdlib/Libdl`] ⇒ 
  [37e2e46d] ~ LinearAlgebra  [`@stdlib/LinearAlgebra`] ⇒ 
  [56ddb016] ~ Logging  [`@stdlib/Logging`] ⇒ 
  [d6f4376e] ~ Markdown  [`@stdlib/Markdown`] ⇒ 
  [de0858da] ~ Printf  [`@stdlib/Printf`] ⇒ 
  [9a3f8284] ~ Random  [`@stdlib/Random`] ⇒ 
  [ea8e919c] ~ SHA  [`@stdlib/SHA`] ⇒ 
  [9e88b42a] ~ Serialization  [`@stdlib/Serialization`] ⇒ 
  [6462fe0b] ~ Sockets  [`@stdlib/Sockets`] ⇒ 
  [cf7118a7] ~ UUIDs  [`@stdlib/UUIDs`] ⇒ 
  [4ec0a83e] ~ Unicode  [`@stdlib/Unicode`] ⇒ 
[ Info: New package is at /tmp/jl_txRiqq/dev/TestPkg
┌ Warning: Git config option 'user.name' missing, package generation will fail unless you supply a GitConfig
└ @ PkgTemplates ~/.julia/packages/PkgTemplates/DXe8J/src/template.jl:242
┌ Warning: Git config option 'user.email' missing, package generation will fail unless you supply a GitConfig
└ @ PkgTemplates ~/.julia/packages/PkgTemplates/DXe8J/src/template.jl:242
Generating  project TestPkg:
    /tmp/jl_txRiqq/dev/TestPkg/Project.toml
    /tmp/jl_txRiqq/dev/TestPkg/src/TestPkg.jl
[ Info: Initialized Git repo at /tmp/jl_txRiqq/dev/TestPkg
[ Info: Set remote origin to git@github.com:christopher-dG/TestPkg.jl.git
Activating environment at `/tmp/jl_txRiqq/dev/TestPkg/Project.toml`
 Resolving package versions...
  Updating `/tmp/jl_txRiqq/dev/TestPkg/Project.toml`
  [8dfed614] + Test 
  Updating `/tmp/jl_txRiqq/dev/TestPkg/Manifest.toml`
  [2a0f44e3] + Base64 
  [8ba89e20] + Distributed 
  [b77e0a4c] + InteractiveUtils 
  [56ddb016] + Logging 
  [d6f4376e] + Markdown 
  [9a3f8284] + Random 
  [9e88b42a] + Serialization 
  [6462fe0b] + Sockets 
  [8dfed614] + Test 
  Updating `/tmp/jl_txRiqq/dev/TestPkg/Project.toml`
 [no changes]
  Updating `/tmp/jl_txRiqq/dev/TestPkg/Manifest.toml`
  [2a0f44e3] - Base64 
  [8ba89e20] - Distributed 
  [b77e0a4c] - InteractiveUtils 
  [56ddb016] - Logging 
  [d6f4376e] - Markdown 
  [9a3f8284] - Random 
  [9e88b42a] - Serialization 
  [6462fe0b] - Sockets 
  [8dfed614] - Test 
Activating environment at `/tmp/jl_GtFPQl/Project.toml`
[ Info: Committed 6 files/directories: src/, Project.toml, test/, README.md, LICENSE, .gitignore
Path `/tmp/jl_txRiqq/dev/TestPkg` exists and looks like the correct package. Using existing path.
Package generation: Error During Test at /root/.julia/packages/PkgTemplates/DXe8J/test/tests.jl:246
  Got exception outside of a @test
  refusing to add package `TestPkg [40241a3e]`: package `TestPkg = "bd327738-9b37-41c6-800e-058cdeaa5ed3"` already exists as a direct dependency
  Stacktrace:
   [1] pkgerror(::String, ::Vararg{String,N} where N) at /buildworker/worker/package_linux64/build/usr/share/julia/stdlib/v1.4/Pkg/src/Types.jl:53
   [2] assert_can_add(::Pkg.Types.Context, ::Array{Pkg.Types.PackageSpec,1}) at /buildworker/worker/package_linux64/build/usr/share/julia/stdlib/v1.4/Pkg/src/Operations.jl:965
   [3] develop(::Pkg.Types.Context, ::Array{Pkg.Types.PackageSpec,1}, ::Array{Base.UUID,1}; strict::Bool, platform::Pkg.BinaryPlatforms.Linux) at /buildworker/worker/package_linux64/build/usr/share/julia/stdlib/v1.4/Pkg/src/Operations.jl:1050
   [4] develop(::Pkg.Types.Context, ::Array{Pkg.Types.PackageSpec,1}; shared::Bool, strict::Bool, platform::Pkg.BinaryPlatforms.Linux, kwargs::Base.Iterators.Pairs{Union{},Union{},Tuple{},NamedTuple{(),Tuple{}}}) at /buildworker/worker/package_linux64/build/usr/share/julia/stdlib/v1.4/Pkg/src/API.jl:86
   [5] develop(::Pkg.Types.Context, ::Array{Pkg.Types.PackageSpec,1}) at /buildworker/worker/package_linux64/build/usr/share/julia/stdlib/v1.4/Pkg/src/API.jl:57
   [6] develop(::Array{Pkg.Types.PackageSpec,1}; kwargs::Base.Iterators.Pairs{Union{},Union{},Tuple{},NamedTuple{(),Tuple{}}}) at /buildworker/worker/package_linux64/build/usr/share/julia/stdlib/v1.4/Pkg/src/API.jl:54
   [7] develop(::Array{Pkg.Types.PackageSpec,1}) at /buildworker/worker/package_linux64/build/usr/share/julia/stdlib/v1.4/Pkg/src/API.jl:54
   [8] develop(::Pkg.Types.PackageSpec; kwargs::Base.Iterators.Pairs{Union{},Union{},Tuple{},NamedTuple{(),Tuple{}}}) at /buildworker/worker/package_linux64/build/usr/share/julia/stdlib/v1.4/Pkg/src/API.jl:51
   [9] develop at /buildworker/worker/package_linux64/build/usr/share/julia/stdlib/v1.4/Pkg/src/API.jl:51 [inlined]
   [10] generate(::String, ::Template; git::Bool, gitconfig::GitConfig) at /root/.julia/packages/PkgTemplates/DXe8J/src/generate.jl:90
   [11] #generate#20 at /root/.julia/packages/PkgTemplates/DXe8J/src/generate.jl:106 [inlined]
   [12] top-level scope at /root/.julia/packages/PkgTemplates/DXe8J/test/tests.jl:278
   [13] top-level scope at /buildworker/worker/package_linux64/build/usr/share/julia/stdlib/v1.4/Test/src/Test.jl:1110
   [14] top-level scope at /root/.julia/packages/PkgTemplates/DXe8J/test/tests.jl:247
   [15] include(::String) at ./client.jl:439
   [16] macro expansion at /root/.julia/packages/PkgTemplates/DXe8J/test/runtests.jl:17 [inlined]
   [17] macro expansion at /buildworker/worker/package_linux64/build/usr/share/julia/stdlib/v1.4/Test/src/Test.jl:1110 [inlined]
   [18] (::var"#4#6")() at /root/.julia/packages/PkgTemplates/DXe8J/test/runtests.jl:17
   [19] cd(::var"#4#6", ::String) at ./file.jl:104
   [20] (::var"#3#5")(::String) at /root/.julia/packages/PkgTemplates/DXe8J/test/runtests.jl:15
   [21] mktempdir(::var"#3#5", ::String; prefix::String) at ./file.jl:669
   [22] mktempdir(::Function, ::String) at ./file.jl:667 (repeats 2 times)
   [23] top-level scope at /root/.julia/packages/PkgTemplates/DXe8J/test/runtests.jl:12
   [24] include(::String) at ./client.jl:439
   [25] top-level scope at none:6
   [26] eval(::Module, ::Any) at ./boot.jl:331
   [27] exec_options(::Base.JLOptions) at ./client.jl:264
   [28] _start() at ./client.jl:484
  
┌ Warning: Git config option 'user.name' missing, package generation will fail unless you supply a GitConfig
└ @ PkgTemplates ~/.julia/packages/PkgTemplates/DXe8J/src/template.jl:242
┌ Warning: Git config option 'user.email' missing, package generation will fail unless you supply a GitConfig
└ @ PkgTemplates ~/.julia/packages/PkgTemplates/DXe8J/src/template.jl:242
Generating  project TestPkg:
    /tmp/jl_txRiqq/dev/TestPkg/Project.toml
    /tmp/jl_txRiqq/dev/TestPkg/src/TestPkg.jl
Activating environment at `/tmp/jl_txRiqq/dev/TestPkg/Project.toml`
 Resolving package versions...
  Updating `/tmp/jl_txRiqq/dev/TestPkg/Project.toml`
  [8dfed614] + Test 
  Updating `/tmp/jl_txRiqq/dev/TestPkg/Manifest.toml`
  [2a0f44e3] + Base64 
  [8ba89e20] + Distributed 
  [b77e0a4c] + InteractiveUtils 
  [56ddb016] + Logging 
  [d6f4376e] + Markdown 
  [9a3f8284] + Random 
  [9e88b42a] + Serialization 
  [6462fe0b] + Sockets 
  [8dfed614] + Test 
  Updating `/tmp/jl_txRiqq/dev/TestPkg/Project.toml`
 [no changes]
  Updating `/tmp/jl_txRiqq/dev/TestPkg/Manifest.toml`
  [2a0f44e3] - Base64 
  [8ba89e20] - Distributed 
  [b77e0a4c] - InteractiveUtils 
  [56ddb016] - Logging 
  [d6f4376e] - Markdown 
  [9a3f8284] - Random 
  [9e88b42a] - Serialization 
  [6462fe0b] - Sockets 
  [8dfed614] - Test 
Activating environment at `/tmp/jl_GtFPQl/Project.toml`
Path `/tmp/jl_txRiqq/dev/TestPkg` exists and looks like the correct package. Using existing path.
  Updating `/tmp/jl_GtFPQl/Project.toml`
 [no changes]
  Updating `/tmp/jl_GtFPQl/Manifest.toml`
 [no changes]
[ Info: New package is at /tmp/jl_txRiqq/dev/TestPkg
┌ Warning: Git config option 'user.name' missing, package generation will fail unless you supply a GitConfig
└ @ PkgTemplates ~/.julia/packages/PkgTemplates/DXe8J/src/template.jl:242
┌ Warning: Git config option 'user.email' missing, package generation will fail unless you supply a GitConfig
└ @ PkgTemplates ~/.julia/packages/PkgTemplates/DXe8J/src/template.jl:242
┌ Warning: Git config option 'user.name' missing, package generation will fail unless you supply a GitConfig
└ @ PkgTemplates ~/.julia/packages/PkgTemplates/DXe8J/src/template.jl:242
┌ Warning: Git config option 'user.email' missing, package generation will fail unless you supply a GitConfig
└ @ PkgTemplates ~/.julia/packages/PkgTemplates/DXe8J/src/template.jl:242
┌ Warning: Git config option 'user.name' missing, package generation will fail unless you supply a GitConfig
└ @ PkgTemplates ~/.julia/packages/PkgTemplates/DXe8J/src/template.jl:242
┌ Warning: Git config option 'user.email' missing, package generation will fail unless you supply a GitConfig
└ @ PkgTemplates ~/.julia/packages/PkgTemplates/DXe8J/src/template.jl:242
┌ Warning: Git config option 'user.name' missing, package generation will fail unless you supply a GitConfig
└ @ PkgTemplates ~/.julia/packages/PkgTemplates/DXe8J/src/template.jl:242
┌ Warning: Git config option 'user.email' missing, package generation will fail unless you supply a GitConfig
└ @ PkgTemplates ~/.julia/packages/PkgTemplates/DXe8J/src/template.jl:242
┌ Warning: Git config option 'user.name' missing, package generation will fail unless you supply a GitConfig
└ @ PkgTemplates ~/.julia/packages/PkgTemplates/DXe8J/src/template.jl:242
┌ Warning: Git config option 'user.email' missing, package generation will fail unless you supply a GitConfig
└ @ PkgTemplates ~/.julia/packages/PkgTemplates/DXe8J/src/template.jl:242
┌ Warning: Git config option 'user.name' missing, package generation will fail unless you supply a GitConfig
└ @ PkgTemplates ~/.julia/packages/PkgTemplates/DXe8J/src/template.jl:242
┌ Warning: Git config option 'user.email' missing, package generation will fail unless you supply a GitConfig
└ @ PkgTemplates ~/.julia/packages/PkgTemplates/DXe8J/src/template.jl:242
┌ Warning: Git config option 'user.name' missing, package generation will fail unless you supply a GitConfig
└ @ PkgTemplates ~/.julia/packages/PkgTemplates/DXe8J/src/template.jl:242
┌ Warning: Git config option 'user.email' missing, package generation will fail unless you supply a GitConfig
└ @ PkgTemplates ~/.julia/packages/PkgTemplates/DXe8J/src/template.jl:242
┌ Warning: Git config option 'user.name' missing, package generation will fail unless you supply a GitConfig
└ @ PkgTemplates ~/.julia/packages/PkgTemplates/DXe8J/src/template.jl:242
┌ Warning: Git config option 'user.email' missing, package generation will fail unless you supply a GitConfig
└ @ PkgTemplates ~/.julia/packages/PkgTemplates/DXe8J/src/template.jl:242
┌ Warning: Git config option 'user.name' missing, package generation will fail unless you supply a GitConfig
└ @ PkgTemplates ~/.julia/packages/PkgTemplates/DXe8J/src/template.jl:242
┌ Warning: Git config option 'user.email' missing, package generation will fail unless you supply a GitConfig
└ @ PkgTemplates ~/.julia/packages/PkgTemplates/DXe8J/src/template.jl:242
┌ Warning: Git config option 'user.name' missing, package generation will fail unless you supply a GitConfig
└ @ PkgTemplates ~/.julia/packages/PkgTemplates/DXe8J/src/template.jl:242
┌ Warning: Git config option 'user.email' missing, package generation will fail unless you supply a GitConfig
└ @ PkgTemplates ~/.julia/packages/PkgTemplates/DXe8J/src/template.jl:242
Activating new environment at `/tmp/jl_txRiqq/dev/TestPkg/docs/Project.toml`
 Resolving package versions...
 Installed Parsers ───────────── v0.3.10
 Installed JSON ──────────────── v0.21.0
 Installed DocStringExtensions ─ v0.8.1
 Installed Documenter ────────── v0.24.0
  Updating `/tmp/jl_txRiqq/dev/TestPkg/docs/Project.toml`
  [e30172f5] + Documenter v0.24.0
  Updating `/tmp/jl_txRiqq/dev/TestPkg/docs/Manifest.toml`
  [ffbed154] + DocStringExtensions v0.8.1
  [e30172f5] + Documenter v0.24.0
  [682c06a0] + JSON v0.21.0
  [69de0a69] + Parsers v0.3.10
  [2a0f44e3] + Base64 
  [ade2ca70] + Dates 
  [8ba89e20] + Distributed 
  [b77e0a4c] + InteractiveUtils 
  [76f85450] + LibGit2 
  [8f399da3] + Libdl 
  [56ddb016] + Logging 
  [d6f4376e] + Markdown 
  [a63ad114] + Mmap 
  [44cfe95a] + Pkg 
  [de0858da] + Printf 
  [3fa0cd96] + REPL 
  [9a3f8284] + Random 
  [ea8e919c] + SHA 
  [9e88b42a] + Serialization 
  [6462fe0b] + Sockets 
  [8dfed614] + Test 
  [cf7118a7] + UUIDs 
  [4ec0a83e] + Unicode 
Activating environment at `/tmp/jl_GtFPQl/Project.toml`
Activating new environment at `/tmp/jl_txRiqq/dev/TestPkg/docs/Project.toml`
 Resolving package versions...
  Updating `/tmp/jl_txRiqq/dev/TestPkg/docs/Project.toml`
  [e30172f5] + Documenter v0.24.0
  Updating `/tmp/jl_txRiqq/dev/TestPkg/docs/Manifest.toml`
  [ffbed154] + DocStringExtensions v0.8.1
  [e30172f5] + Documenter v0.24.0
  [682c06a0] + JSON v0.21.0
  [69de0a69] + Parsers v0.3.10
  [2a0f44e3] + Base64 
  [ade2ca70] + Dates 
  [8ba89e20] + Distributed 
  [b77e0a4c] + InteractiveUtils 
  [76f85450] + LibGit2 
  [8f399da3] + Libdl 
  [56ddb016] + Logging 
  [d6f4376e] + Markdown 
  [a63ad114] + Mmap 
  [44cfe95a] + Pkg 
  [de0858da] + Printf 
  [3fa0cd96] + REPL 
  [9a3f8284] + Random 
  [ea8e919c] + SHA 
  [9e88b42a] + Serialization 
  [6462fe0b] + Sockets 
  [8dfed614] + Test 
  [cf7118a7] + UUIDs 
  [4ec0a83e] + Unicode 
Activating environment at `/tmp/jl_GtFPQl/Project.toml`
Activating new environment at `/tmp/jl_txRiqq/dev/TestPkg/docs/Project.toml`
 Resolving package versions...
  Updating `/tmp/jl_txRiqq/dev/TestPkg/docs/Project.toml`
  [e30172f5] + Documenter v0.24.0
  Updating `/tmp/jl_txRiqq/dev/TestPkg/docs/Manifest.toml`
  [ffbed154] + DocStringExtensions v0.8.1
  [e30172f5] + Documenter v0.24.0
  [682c06a0] + JSON v0.21.0
  [69de0a69] + Parsers v0.3.10
  [2a0f44e3] + Base64 
  [ade2ca70] + Dates 
  [8ba89e20] + Distributed 
  [b77e0a4c] + InteractiveUtils 
  [76f85450] + LibGit2 
  [8f399da3] + Libdl 
  [56ddb016] + Logging 
  [d6f4376e] + Markdown 
  [a63ad114] + Mmap 
  [44cfe95a] + Pkg 
  [de0858da] + Printf 
  [3fa0cd96] + REPL 
  [9a3f8284] + Random 
  [ea8e919c] + SHA 
  [9e88b42a] + Serialization 
  [6462fe0b] + Sockets 
  [8dfed614] + Test 
  [cf7118a7] + UUIDs 
  [4ec0a83e] + Unicode 
Activating environment at `/tmp/jl_GtFPQl/Project.toml`
┌ Warning: Git config option 'user.name' missing, package generation will fail unless you supply a GitConfig
└ @ PkgTemplates ~/.julia/packages/PkgTemplates/DXe8J/src/template.jl:242
┌ Warning: Git config option 'user.email' missing, package generation will fail unless you supply a GitConfig
└ @ PkgTemplates ~/.julia/packages/PkgTemplates/DXe8J/src/template.jl:242
Generating  project TestPkg:
    /tmp/jl_sVnRBc/TestPkg/Project.toml
    /tmp/jl_sVnRBc/TestPkg/src/TestPkg.jl
[ Info: Initialized Git repo at /tmp/jl_sVnRBc/TestPkg
[ Info: Set remote origin to https://github.com/christopher-dG/TestPkg.jl
[ Info: Created empty gh-pages branch
Activating environment at `/tmp/jl_sVnRBc/TestPkg/Project.toml`
 Resolving package versions...
  Updating `/tmp/jl_sVnRBc/TestPkg/Project.toml`
  [8dfed614] + Test 
  Updating `/tmp/jl_sVnRBc/TestPkg/Manifest.toml`
  [2a0f44e3] + Base64 
  [8ba89e20] + Distributed 
  [b77e0a4c] + InteractiveUtils 
  [56ddb016] + Logging 
  [d6f4376e] + Markdown 
  [9a3f8284] + Random 
  [9e88b42a] + Serialization 
  [6462fe0b] + Sockets 
  [8dfed614] + Test 
  Updating `/tmp/jl_sVnRBc/TestPkg/Project.toml`
 [no changes]
  Updating `/tmp/jl_sVnRBc/TestPkg/Manifest.toml`
  [2a0f44e3] - Base64 
  [8ba89e20] - Distributed 
  [b77e0a4c] - InteractiveUtils 
  [56ddb016] - Logging 
  [d6f4376e] - Markdown 
  [9a3f8284] - Random 
  [9e88b42a] - Serialization 
  [6462fe0b] - Sockets 
  [8dfed614] - Test 
Activating environment at `/tmp/jl_GtFPQl/Project.toml`
Activating new environment at `/tmp/jl_sVnRBc/TestPkg/docs/Project.toml`
 Resolving package versions...
  Updating `/tmp/jl_sVnRBc/TestPkg/docs/Project.toml`
  [e30172f5] + Documenter v0.24.0
  Updating `/tmp/jl_sVnRBc/TestPkg/docs/Manifest.toml`
  [ffbed154] + DocStringExtensions v0.8.1
  [e30172f5] + Documenter v0.24.0
  [682c06a0] + JSON v0.21.0
  [69de0a69] + Parsers v0.3.10
  [2a0f44e3] + Base64 
  [ade2ca70] + Dates 
  [8ba89e20] + Distributed 
  [b77e0a4c] + InteractiveUtils 
  [76f85450] + LibGit2 
  [8f399da3] + Libdl 
  [56ddb016] + Logging 
  [d6f4376e] + Markdown 
  [a63ad114] + Mmap 
  [44cfe95a] + Pkg 
  [de0858da] + Printf 
  [3fa0cd96] + REPL 
  [9a3f8284] + Random 
  [ea8e919c] + SHA 
  [9e88b42a] + Serialization 
  [6462fe0b] + Sockets 
  [8dfed614] + Test 
  [cf7118a7] + UUIDs 
  [4ec0a83e] + Unicode 
Activating environment at `/tmp/jl_GtFPQl/Project.toml`
[ Info: Committed 7 files/directories: src/, Project.toml, test/, README.md, LICENSE, docs/, .gitignore
[ Info: Remember to push all created branches to your remote: git push --all
Path `/tmp/jl_sVnRBc/TestPkg` exists and looks like the correct package. Using existing path.
  Updating `/tmp/jl_GtFPQl/Project.toml`
  [bd327738] ~ TestPkg v0.1.0 [`/tmp/jl_txRiqq/dev/TestPkg`] ⇒ v0.1.0 [`/tmp/jl_sVnRBc/TestPkg`]
  Updating `/tmp/jl_GtFPQl/Manifest.toml`
  [bd327738] ~ TestPkg v0.1.0 [`/tmp/jl_txRiqq/dev/TestPkg`] ⇒ v0.1.0 [`/tmp/jl_sVnRBc/TestPkg`]
[ Info: New package is at /tmp/jl_sVnRBc/TestPkg
┌ Warning: Git config option 'user.name' missing, package generation will fail unless you supply a GitConfig
└ @ PkgTemplates ~/.julia/packages/PkgTemplates/DXe8J/src/template.jl:242
┌ Warning: Git config option 'user.email' missing, package generation will fail unless you supply a GitConfig
└ @ PkgTemplates ~/.julia/packages/PkgTemplates/DXe8J/src/template.jl:242
Activating new environment at `/tmp/jl_txRiqq/dev/TestPkg/docs/Project.toml`
 Resolving package versions...
  Updating `/tmp/jl_txRiqq/dev/TestPkg/docs/Project.toml`
  [e30172f5] + Documenter v0.24.0
  Updating `/tmp/jl_txRiqq/dev/TestPkg/docs/Manifest.toml`
  [ffbed154] + DocStringExtensions v0.8.1
  [e30172f5] + Documenter v0.24.0
  [682c06a0] + JSON v0.21.0
  [69de0a69] + Parsers v0.3.10
  [2a0f44e3] + Base64 
  [ade2ca70] + Dates 
  [8ba89e20] + Distributed 
  [b77e0a4c] + InteractiveUtils 
  [76f85450] + LibGit2 
  [8f399da3] + Libdl 
  [56ddb016] + Logging 
  [d6f4376e] + Markdown 
  [a63ad114] + Mmap 
  [44cfe95a] + Pkg 
  [de0858da] + Printf 
  [3fa0cd96] + REPL 
  [9a3f8284] + Random 
  [ea8e919c] + SHA 
  [9e88b42a] + Serialization 
  [6462fe0b] + Sockets 
  [8dfed614] + Test 
  [cf7118a7] + UUIDs 
  [4ec0a83e] + Unicode 
Activating environment at `/tmp/jl_GtFPQl/Project.toml`
Activating new environment at `/tmp/jl_txRiqq/dev/TestPkg/docs/Project.toml`
 Resolving package versions...
  Updating `/tmp/jl_txRiqq/dev/TestPkg/docs/Project.toml`
  [e30172f5] + Documenter v0.24.0
  Updating `/tmp/jl_txRiqq/dev/TestPkg/docs/Manifest.toml`
  [ffbed154] + DocStringExtensions v0.8.1
  [e30172f5] + Documenter v0.24.0
  [682c06a0] + JSON v0.21.0
  [69de0a69] + Parsers v0.3.10
  [2a0f44e3] + Base64 
  [ade2ca70] + Dates 
  [8ba89e20] + Distributed 
  [b77e0a4c] + InteractiveUtils 
  [76f85450] + LibGit2 
  [8f399da3] + Libdl 
  [56ddb016] + Logging 
  [d6f4376e] + Markdown 
  [a63ad114] + Mmap 
  [44cfe95a] + Pkg 
  [de0858da] + Printf 
  [3fa0cd96] + REPL 
  [9a3f8284] + Random 
  [ea8e919c] + SHA 
  [9e88b42a] + Serialization 
  [6462fe0b] + Sockets 
  [8dfed614] + Test 
  [cf7118a7] + UUIDs 
  [4ec0a83e] + Unicode 
Activating environment at `/tmp/jl_GtFPQl/Project.toml`
┌ Warning: Git config option 'user.name' missing, package generation will fail unless you supply a GitConfig
└ @ PkgTemplates ~/.julia/packages/PkgTemplates/DXe8J/src/template.jl:242
┌ Warning: Git config option 'user.email' missing, package generation will fail unless you supply a GitConfig
└ @ PkgTemplates ~/.julia/packages/PkgTemplates/DXe8J/src/template.jl:242
Generating  project TestPkg:
    /tmp/jl_FhnOIL/TestPkg/Project.toml
    /tmp/jl_FhnOIL/TestPkg/src/TestPkg.jl
[ Info: Initialized Git repo at /tmp/jl_FhnOIL/TestPkg
[ Info: Set remote origin to https://github.com/christopher-dG/TestPkg.jl
Activating environment at `/tmp/jl_FhnOIL/TestPkg/Project.toml`
 Resolving package versions...
  Updating `/tmp/jl_FhnOIL/TestPkg/Project.toml`
  [8dfed614] + Test 
  Updating `/tmp/jl_FhnOIL/TestPkg/Manifest.toml`
  [2a0f44e3] + Base64 
  [8ba89e20] + Distributed 
  [b77e0a4c] + InteractiveUtils 
  [56ddb016] + Logging 
  [d6f4376e] + Markdown 
  [9a3f8284] + Random 
  [9e88b42a] + Serialization 
  [6462fe0b] + Sockets 
  [8dfed614] + Test 
  Updating `/tmp/jl_FhnOIL/TestPkg/Project.toml`
 [no changes]
  Updating `/tmp/jl_FhnOIL/TestPkg/Manifest.toml`
  [2a0f44e3] - Base64 
  [8ba89e20] - Distributed 
  [b77e0a4c] - InteractiveUtils 
  [56ddb016] - Logging 
  [d6f4376e] - Markdown 
  [9a3f8284] - Random 
  [9e88b42a] - Serialization 
  [6462fe0b] - Sockets 
  [8dfed614] - Test 
Activating environment at `/tmp/jl_GtFPQl/Project.toml`
Activating new environment at `/tmp/jl_FhnOIL/TestPkg/docs/Project.toml`
 Resolving package versions...
  Updating `/tmp/jl_FhnOIL/TestPkg/docs/Project.toml`
  [e30172f5] + Documenter v0.24.0
  Updating `/tmp/jl_FhnOIL/TestPkg/docs/Manifest.toml`
  [ffbed154] + DocStringExtensions v0.8.1
  [e30172f5] + Documenter v0.24.0
  [682c06a0] + JSON v0.21.0
  [69de0a69] + Parsers v0.3.10
  [2a0f44e3] + Base64 
  [ade2ca70] + Dates 
  [8ba89e20] + Distributed 
  [b77e0a4c] + InteractiveUtils 
  [76f85450] + LibGit2 
  [8f399da3] + Libdl 
  [56ddb016] + Logging 
  [d6f4376e] + Markdown 
  [a63ad114] + Mmap 
  [44cfe95a] + Pkg 
  [de0858da] + Printf 
  [3fa0cd96] + REPL 
  [9a3f8284] + Random 
  [ea8e919c] + SHA 
  [9e88b42a] + Serialization 
  [6462fe0b] + Sockets 
  [8dfed614] + Test 
  [cf7118a7] + UUIDs 
  [4ec0a83e] + Unicode 
Activating environment at `/tmp/jl_GtFPQl/Project.toml`
[ Info: Committed 8 files/directories: src/, Project.toml, test/, README.md, LICENSE, docs/, .gitlab-ci.yml, .gitignore
Path `/tmp/jl_FhnOIL/TestPkg` exists and looks like the correct package. Using existing path.
  Updating `/tmp/jl_GtFPQl/Project.toml`
  [bd327738] ~ TestPkg v0.1.0 [`/tmp/jl_sVnRBc/TestPkg`] ⇒ v0.1.0 [`/tmp/jl_FhnOIL/TestPkg`]
  Updating `/tmp/jl_GtFPQl/Manifest.toml`
  [bd327738] ~ TestPkg v0.1.0 [`/tmp/jl_sVnRBc/TestPkg`] ⇒ v0.1.0 [`/tmp/jl_FhnOIL/TestPkg`]
[ Info: New package is at /tmp/jl_FhnOIL/TestPkg
┌ Warning: Git config option 'user.name' missing, package generation will fail unless you supply a GitConfig
└ @ PkgTemplates ~/.julia/packages/PkgTemplates/DXe8J/src/template.jl:242
┌ Warning: Git config option 'user.email' missing, package generation will fail unless you supply a GitConfig
└ @ PkgTemplates ~/.julia/packages/PkgTemplates/DXe8J/src/template.jl:242
Generating  project TestPkg:
    /tmp/jl_txRiqq/dev/TestPkg/Project.toml
    /tmp/jl_txRiqq/dev/TestPkg/src/TestPkg.jl
Activating environment at `/tmp/jl_txRiqq/dev/TestPkg/Project.toml`
 Resolving package versions...
  Updating `/tmp/jl_txRiqq/dev/TestPkg/Project.toml`
  [8dfed614] + Test 
  Updating `/tmp/jl_txRiqq/dev/TestPkg/Manifest.toml`
  [2a0f44e3] + Base64 
  [8ba89e20] + Distributed 
  [b77e0a4c] + InteractiveUtils 
  [56ddb016] + Logging 
  [d6f4376e] + Markdown 
  [9a3f8284] + Random 
  [9e88b42a] + Serialization 
  [6462fe0b] + Sockets 
  [8dfed614] + Test 
  Updating `/tmp/jl_txRiqq/dev/TestPkg/Project.toml`
 [no changes]
  Updating `/tmp/jl_txRiqq/dev/TestPkg/Manifest.toml`
  [2a0f44e3] - Base64 
  [8ba89e20] - Distributed 
  [b77e0a4c] - InteractiveUtils 
  [56ddb016] - Logging 
  [d6f4376e] - Markdown 
  [9a3f8284] - Random 
  [9e88b42a] - Serialization 
  [6462fe0b] - Sockets 
  [8dfed614] - Test 
Activating environment at `/tmp/jl_GtFPQl/Project.toml`
Path `/tmp/jl_txRiqq/dev/TestPkg` exists and looks like the correct package. Using existing path.
  Updating `/tmp/jl_GtFPQl/Project.toml`
  [bd327738] ~ TestPkg v0.1.0 [`/tmp/jl_FhnOIL/TestPkg`] ⇒ v0.1.0 [`/tmp/jl_txRiqq/dev/TestPkg`]
  Updating `/tmp/jl_GtFPQl/Manifest.toml`
  [bd327738] ~ TestPkg v0.1.0 [`/tmp/jl_FhnOIL/TestPkg`] ⇒ v0.1.0 [`/tmp/jl_txRiqq/dev/TestPkg`]
[ Info: New package is at /tmp/jl_txRiqq/dev/TestPkg
Generating  project TestPkg:
    /tmp/jl_txRiqq/dev/TestPkg/Project.toml
    /tmp/jl_txRiqq/dev/TestPkg/src/TestPkg.jl
Activating environment at `/tmp/jl_txRiqq/dev/TestPkg/Project.toml`
 Resolving package versions...
  Updating `/tmp/jl_txRiqq/dev/TestPkg/Project.toml`
  [8dfed614] + Test 
  Updating `/tmp/jl_txRiqq/dev/TestPkg/Manifest.toml`
  [2a0f44e3] + Base64 
  [8ba89e20] + Distributed 
  [b77e0a4c] + InteractiveUtils 
  [56ddb016] + Logging 
  [d6f4376e] + Markdown 
  [9a3f8284] + Random 
  [9e88b42a] + Serialization 
  [6462fe0b] + Sockets 
  [8dfed614] + Test 
  Updating `/tmp/jl_txRiqq/dev/TestPkg/Project.toml`
 [no changes]
  Updating `/tmp/jl_txRiqq/dev/TestPkg/Manifest.toml`
  [2a0f44e3] - Base64 
  [8ba89e20] - Distributed 
  [b77e0a4c] - InteractiveUtils 
  [56ddb016] - Logging 
  [d6f4376e] - Markdown 
  [9a3f8284] - Random 
  [9e88b42a] - Serialization 
  [6462fe0b] - Sockets 
  [8dfed614] - Test 
Activating environment at `/tmp/jl_GtFPQl/Project.toml`
Path `/tmp/jl_txRiqq/dev/TestPkg` exists and looks like the correct package. Using existing path.
  Updating `/tmp/jl_GtFPQl/Project.toml`
 [no changes]
  Updating `/tmp/jl_GtFPQl/Manifest.toml`
 [no changes]
[ Info: New package is at /tmp/jl_txRiqq/dev/TestPkg
┌ Warning: Git config option 'user.name' missing, package generation will fail unless you supply a GitConfig
└ @ PkgTemplates ~/.julia/packages/PkgTemplates/DXe8J/src/template.jl:242
┌ Warning: Git config option 'user.email' missing, package generation will fail unless you supply a GitConfig
└ @ PkgTemplates ~/.julia/packages/PkgTemplates/DXe8J/src/template.jl:242
Activating new environment at `/tmp/jl_txRiqq/dev/TestPkg/docs/Project.toml`
 Resolving package versions...
  Updating `/tmp/jl_txRiqq/dev/TestPkg/docs/Project.toml`
  [e30172f5] + Documenter v0.24.0
  Updating `/tmp/jl_txRiqq/dev/TestPkg/docs/Manifest.toml`
  [ffbed154] + DocStringExtensions v0.8.1
  [e30172f5] + Documenter v0.24.0
  [682c06a0] + JSON v0.21.0
  [69de0a69] + Parsers v0.3.10
  [2a0f44e3] + Base64 
  [ade2ca70] + Dates 
  [8ba89e20] + Distributed 
  [b77e0a4c] + InteractiveUtils 
  [76f85450] + LibGit2 
  [8f399da3] + Libdl 
  [56ddb016] + Logging 
  [d6f4376e] + Markdown 
  [a63ad114] + Mmap 
  [44cfe95a] + Pkg 
  [de0858da] + Printf 
  [3fa0cd96] + REPL 
  [9a3f8284] + Random 
  [ea8e919c] + SHA 
  [9e88b42a] + Serialization 
  [6462fe0b] + Sockets 
  [8dfed614] + Test 
  [cf7118a7] + UUIDs 
  [4ec0a83e] + Unicode 
Activating environment at `/tmp/jl_GtFPQl/Project.toml`
Activating new environment at `/tmp/jl_txRiqq/dev/TestPkg/docs/Project.toml`
 Resolving package versions...
  Updating `/tmp/jl_txRiqq/dev/TestPkg/docs/Project.toml`
  [e30172f5] + Documenter v0.24.0
  Updating `/tmp/jl_txRiqq/dev/TestPkg/docs/Manifest.toml`
  [ffbed154] + DocStringExtensions v0.8.1
  [e30172f5] + Documenter v0.24.0
  [682c06a0] + JSON v0.21.0
  [69de0a69] + Parsers v0.3.10
  [2a0f44e3] + Base64 
  [ade2ca70] + Dates 
  [8ba89e20] + Distributed 
  [b77e0a4c] + InteractiveUtils 
  [76f85450] + LibGit2 
  [8f399da3] + Libdl 
  [56ddb016] + Logging 
  [d6f4376e] + Markdown 
  [a63ad114] + Mmap 
  [44cfe95a] + Pkg 
  [de0858da] + Printf 
  [3fa0cd96] + REPL 
  [9a3f8284] + Random 
  [ea8e919c] + SHA 
  [9e88b42a] + Serialization 
  [6462fe0b] + Sockets 
  [8dfed614] + Test 
  [cf7118a7] + UUIDs 
  [4ec0a83e] + Unicode 
Activating environment at `/tmp/jl_GtFPQl/Project.toml`
Activating new environment at `/tmp/jl_txRiqq/dev/TestPkg/docs/Project.toml`
 Resolving package versions...
  Updating `/tmp/jl_txRiqq/dev/TestPkg/docs/Project.toml`
  [e30172f5] + Documenter v0.24.0
  Updating `/tmp/jl_txRiqq/dev/TestPkg/docs/Manifest.toml`
  [ffbed154] + DocStringExtensions v0.8.1
  [e30172f5] + Documenter v0.24.0
  [682c06a0] + JSON v0.21.0
  [69de0a69] + Parsers v0.3.10
  [2a0f44e3] + Base64 
  [ade2ca70] + Dates 
  [8ba89e20] + Distributed 
  [b77e0a4c] + InteractiveUtils 
  [76f85450] + LibGit2 
  [8f399da3] + Libdl 
  [56ddb016] + Logging 
  [d6f4376e] + Markdown 
  [a63ad114] + Mmap 
  [44cfe95a] + Pkg 
  [de0858da] + Printf 
  [3fa0cd96] + REPL 
  [9a3f8284] + Random 
  [ea8e919c] + SHA 
  [9e88b42a] + Serialization 
  [6462fe0b] + Sockets 
  [8dfed614] + Test 
  [cf7118a7] + UUIDs 
  [4ec0a83e] + Unicode 
Activating environment at `/tmp/jl_GtFPQl/Project.toml`
Template creation: Error During Test at /root/.julia/packages/PkgTemplates/DXe8J/test/interactive/interactive.jl:2
  Got exception outside of a @test
  type IOStream has no field buffer
  Stacktrace:
   [1] getproperty(::IOStream, ::Symbol) at ./Base.jl:33
   [2] macro expansion at /root/.julia/packages/PkgTemplates/DXe8J/test/interactive/interactive.jl:3 [inlined]
   [3] macro expansion at /buildworker/worker/package_linux64/build/usr/share/julia/stdlib/v1.4/Test/src/Test.jl:1110 [inlined]
   [4] macro expansion at /root/.julia/packages/PkgTemplates/DXe8J/test/interactive/interactive.jl:3 [inlined]
   [5] macro expansion at /buildworker/worker/package_linux64/build/usr/share/julia/stdlib/v1.4/Test/src/Test.jl:1110 [inlined]
   [6] top-level scope at /root/.julia/packages/PkgTemplates/DXe8J/test/interactive/interactive.jl:2
   [7] include(::String) at ./client.jl:439
   [8] top-level scope at /root/.julia/packages/PkgTemplates/DXe8J/test/tests.jl:491
   [9] include(::String) at ./client.jl:439
   [10] macro expansion at /root/.julia/packages/PkgTemplates/DXe8J/test/runtests.jl:17 [inlined]
   [11] macro expansion at /buildworker/worker/package_linux64/build/usr/share/julia/stdlib/v1.4/Test/src/Test.jl:1110 [inlined]
   [12] (::var"#4#6")() at /root/.julia/packages/PkgTemplates/DXe8J/test/runtests.jl:17
   [13] cd(::var"#4#6", ::String) at ./file.jl:104
   [14] (::var"#3#5")(::String) at /root/.julia/packages/PkgTemplates/DXe8J/test/runtests.jl:15
   [15] mktempdir(::var"#3#5", ::String; prefix::String) at ./file.jl:669
   [16] mktempdir(::Function, ::String) at ./file.jl:667 (repeats 2 times)
   [17] top-level scope at /root/.julia/packages/PkgTemplates/DXe8J/test/runtests.jl:12
   [18] include(::String) at ./client.jl:439
   [19] top-level scope at none:6
   [20] eval(::Module, ::Any) at ./boot.jl:331
   [21] exec_options(::Base.JLOptions) at ./client.jl:264
   [22] _start() at ./client.jl:484
  
Package generation: Error During Test at /root/.julia/packages/PkgTemplates/DXe8J/test/interactive/interactive.jl:58
  Got exception outside of a @test
  type IOStream has no field buffer
  Stacktrace:
   [1] getproperty(::IOStream, ::Symbol) at ./Base.jl:33
   [2] macro expansion at /root/.julia/packages/PkgTemplates/DXe8J/test/interactive/interactive.jl:59 [inlined]
   [3] macro expansion at /buildworker/worker/package_linux64/build/usr/share/julia/stdlib/v1.4/Test/src/Test.jl:1110 [inlined]
   [4] macro expansion at /root/.julia/packages/PkgTemplates/DXe8J/test/interactive/interactive.jl:59 [inlined]
   [5] macro expansion at /buildworker/worker/package_linux64/build/usr/share/julia/stdlib/v1.4/Test/src/Test.jl:1110 [inlined]
   [6] top-level scope at /root/.julia/packages/PkgTemplates/DXe8J/test/interactive/interactive.jl:2
   [7] include(::String) at ./client.jl:439
   [8] top-level scope at /root/.julia/packages/PkgTemplates/DXe8J/test/tests.jl:491
   [9] include(::String) at ./client.jl:439
   [10] macro expansion at /root/.julia/packages/PkgTemplates/DXe8J/test/runtests.jl:17 [inlined]
   [11] macro expansion at /buildworker/worker/package_linux64/build/usr/share/julia/stdlib/v1.4/Test/src/Test.jl:1110 [inlined]
   [12] (::var"#4#6")() at /root/.julia/packages/PkgTemplates/DXe8J/test/runtests.jl:17
   [13] cd(::var"#4#6", ::String) at ./file.jl:104
   [14] (::var"#3#5")(::String) at /root/.julia/packages/PkgTemplates/DXe8J/test/runtests.jl:15
   [15] mktempdir(::var"#3#5", ::String; prefix::String) at ./file.jl:669
   [16] mktempdir(::Function, ::String) at ./file.jl:667 (repeats 2 times)
   [17] top-level scope at /root/.julia/packages/PkgTemplates/DXe8J/test/runtests.jl:12
   [18] include(::String) at ./client.jl:439
   [19] top-level scope at none:6
   [20] eval(::Module, ::Any) at ./boot.jl:331
   [21] exec_options(::Base.JLOptions) at ./client.jl:264
   [22] _start() at ./client.jl:484
  
TravisCI: Error During Test at /root/.julia/packages/PkgTemplates/DXe8J/test/interactive/plugins.jl:3
  Got exception outside of a @test
  type IOStream has no field buffer
  Stacktrace:
   [1] getproperty(::IOStream, ::Symbol) at ./Base.jl:33
   [2] macro expansion at /root/.julia/packages/PkgTemplates/DXe8J/test/interactive/plugins.jl:4 [inlined]
   [3] macro expansion at /buildworker/worker/package_linux64/build/usr/share/julia/stdlib/v1.4/Test/src/Test.jl:1110 [inlined]
   [4] top-level scope at /root/.julia/packages/PkgTemplates/DXe8J/test/interactive/plugins.jl:4
   [5] include(::String) at ./client.jl:439
   [6] macro expansion at /root/.julia/packages/PkgTemplates/DXe8J/test/interactive/interactive.jl:66 [inlined]
   [7] macro expansion at /buildworker/worker/package_linux64/build/usr/share/julia/stdlib/v1.4/Test/src/Test.jl:1110 [inlined]
   [8] macro expansion at /root/.julia/packages/PkgTemplates/DXe8J/test/interactive/interactive.jl:66 [inlined]
   [9] macro expansion at /buildworker/worker/package_linux64/build/usr/share/julia/stdlib/v1.4/Test/src/Test.jl:1110 [inlined]
   [10] top-level scope at /root/.julia/packages/PkgTemplates/DXe8J/test/interactive/interactive.jl:2
   [11] include(::String) at ./client.jl:439
   [12] top-level scope at /root/.julia/packages/PkgTemplates/DXe8J/test/tests.jl:491
   [13] include(::String) at ./client.jl:439
   [14] macro expansion at /root/.julia/packages/PkgTemplates/DXe8J/test/runtests.jl:17 [inlined]
   [15] macro expansion at /buildworker/worker/package_linux64/build/usr/share/julia/stdlib/v1.4/Test/src/Test.jl:1110 [inlined]
   [16] (::var"#4#6")() at /root/.julia/packages/PkgTemplates/DXe8J/test/runtests.jl:17
   [17] cd(::var"#4#6", ::String) at ./file.jl:104
   [18] (::var"#3#5")(::String) at /root/.julia/packages/PkgTemplates/DXe8J/test/runtests.jl:15
   [19] mktempdir(::var"#3#5", ::String; prefix::String) at ./file.jl:669
   [20] mktempdir(::Function, ::String) at ./file.jl:667 (repeats 2 times)
   [21] top-level scope at /root/.julia/packages/PkgTemplates/DXe8J/test/runtests.jl:12
   [22] include(::String) at ./client.jl:439
   [23] top-level scope at none:6
   [24] eval(::Module, ::Any) at ./boot.jl:331
   [25] exec_options(::Base.JLOptions) at ./client.jl:264
   [26] _start() at ./client.jl:484
  
AppVeyor: Error During Test at /root/.julia/packages/PkgTemplates/DXe8J/test/interactive/plugins.jl:18
  Got exception outside of a @test
  type IOStream has no field buffer
  Stacktrace:
   [1] getproperty(::IOStream, ::Symbol) at ./Base.jl:33
   [2] macro expansion at /root/.julia/packages/PkgTemplates/DXe8J/test/interactive/plugins.jl:19 [inlined]
   [3] macro expansion at /buildworker/worker/package_linux64/build/usr/share/julia/stdlib/v1.4/Test/src/Test.jl:1110 [inlined]
   [4] top-level scope at /root/.julia/packages/PkgTemplates/DXe8J/test/interactive/plugins.jl:19
   [5] include(::String) at ./client.jl:439
   [6] macro expansion at /root/.julia/packages/PkgTemplates/DXe8J/test/interactive/interactive.jl:66 [inlined]
   [7] macro expansion at /buildworker/worker/package_linux64/build/usr/share/julia/stdlib/v1.4/Test/src/Test.jl:1110 [inlined]
   [8] macro expansion at /root/.julia/packages/PkgTemplates/DXe8J/test/interactive/interactive.jl:66 [inlined]
   [9] macro expansion at /buildworker/worker/package_linux64/build/usr/share/julia/stdlib/v1.4/Test/src/Test.jl:1110 [inlined]
   [10] top-level scope at /root/.julia/packages/PkgTemplates/DXe8J/test/interactive/interactive.jl:2
   [11] include(::String) at ./client.jl:439
   [12] top-level scope at /root/.julia/packages/PkgTemplates/DXe8J/test/tests.jl:491
   [13] include(::String) at ./client.jl:439
   [14] macro expansion at /root/.julia/packages/PkgTemplates/DXe8J/test/runtests.jl:17 [inlined]
   [15] macro expansion at /buildworker/worker/package_linux64/build/usr/share/julia/stdlib/v1.4/Test/src/Test.jl:1110 [inlined]
   [16] (::var"#4#6")() at /root/.julia/packages/PkgTemplates/DXe8J/test/runtests.jl:17
   [17] cd(::var"#4#6", ::String) at ./file.jl:104
   [18] (::var"#3#5")(::String) at /root/.julia/packages/PkgTemplates/DXe8J/test/runtests.jl:15
   [19] mktempdir(::var"#3#5", ::String; prefix::String) at ./file.jl:669
   [20] mktempdir(::Function, ::String) at ./file.jl:667 (repeats 2 times)
   [21] top-level scope at /root/.julia/packages/PkgTemplates/DXe8J/test/runtests.jl:12
   [22] include(::String) at ./client.jl:439
   [23] top-level scope at none:6
   [24] eval(::Module, ::Any) at ./boot.jl:331
   [25] exec_options(::Base.JLOptions) at ./client.jl:264
   [26] _start() at ./client.jl:484
  
GitLabCI: Error During Test at /root/.julia/packages/PkgTemplates/DXe8J/test/interactive/plugins.jl:33
  Got exception outside of a @test
  type IOStream has no field buffer
  Stacktrace:
   [1] getproperty(::IOStream, ::Symbol) at ./Base.jl:33
   [2] macro expansion at /root/.julia/packages/PkgTemplates/DXe8J/test/interactive/plugins.jl:34 [inlined]
   [3] macro expansion at /buildworker/worker/package_linux64/build/usr/share/julia/stdlib/v1.4/Test/src/Test.jl:1110 [inlined]
   [4] top-level scope at /root/.julia/packages/PkgTemplates/DXe8J/test/interactive/plugins.jl:34
   [5] include(::String) at ./client.jl:439
   [6] macro expansion at /root/.julia/packages/PkgTemplates/DXe8J/test/interactive/interactive.jl:66 [inlined]
   [7] macro expansion at /buildworker/worker/package_linux64/build/usr/share/julia/stdlib/v1.4/Test/src/Test.jl:1110 [inlined]
   [8] macro expansion at /root/.julia/packages/PkgTemplates/DXe8J/test/interactive/interactive.jl:66 [inlined]
   [9] macro expansion at /buildworker/worker/package_linux64/build/usr/share/julia/stdlib/v1.4/Test/src/Test.jl:1110 [inlined]
   [10] top-level scope at /root/.julia/packages/PkgTemplates/DXe8J/test/interactive/interactive.jl:2
   [11] include(::String) at ./client.jl:439
   [12] top-level scope at /root/.julia/packages/PkgTemplates/DXe8J/test/tests.jl:491
   [13] include(::String) at ./client.jl:439
   [14] macro expansion at /root/.julia/packages/PkgTemplates/DXe8J/test/runtests.jl:17 [inlined]
   [15] macro expansion at /buildworker/worker/package_linux64/build/usr/share/julia/stdlib/v1.4/Test/src/Test.jl:1110 [inlined]
   [16] (::var"#4#6")() at /root/.julia/packages/PkgTemplates/DXe8J/test/runtests.jl:17
   [17] cd(::var"#4#6", ::String) at ./file.jl:104
   [18] (::var"#3#5")(::String) at /root/.julia/packages/PkgTemplates/DXe8J/test/runtests.jl:15
   [19] mktempdir(::var"#3#5", ::String; prefix::String) at ./file.jl:669
   [20] mktempdir(::Function, ::String) at ./file.jl:667 (repeats 2 times)
   [21] top-level scope at /root/.julia/packages/PkgTemplates/DXe8J/test/runtests.jl:12
   [22] include(::String) at ./client.jl:439
   [23] top-level scope at none:6
   [24] eval(::Module, ::Any) at ./boot.jl:331
   [25] exec_options(::Base.JLOptions) at ./client.jl:264
   [26] _start() at ./client.jl:484
  
Codecov: Error During Test at /root/.julia/packages/PkgTemplates/DXe8J/test/interactive/plugins.jl:50
  Got exception outside of a @test
  type IOStream has no field buffer
  Stacktrace:
   [1] getproperty(::IOStream, ::Symbol) at ./Base.jl:33
   [2] macro expansion at /root/.julia/packages/PkgTemplates/DXe8J/test/interactive/plugins.jl:51 [inlined]
   [3] macro expansion at /buildworker/worker/package_linux64/build/usr/share/julia/stdlib/v1.4/Test/src/Test.jl:1110 [inlined]
   [4] top-level scope at /root/.julia/packages/PkgTemplates/DXe8J/test/interactive/plugins.jl:51
   [5] include(::String) at ./client.jl:439
   [6] macro expansion at /root/.julia/packages/PkgTemplates/DXe8J/test/interactive/interactive.jl:66 [inlined]
   [7] macro expansion at /buildworker/worker/package_linux64/build/usr/share/julia/stdlib/v1.4/Test/src/Test.jl:1110 [inlined]
   [8] macro expansion at /root/.julia/packages/PkgTemplates/DXe8J/test/interactive/interactive.jl:66 [inlined]
   [9] macro expansion at /buildworker/worker/package_linux64/build/usr/share/julia/stdlib/v1.4/Test/src/Test.jl:1110 [inlined]
   [10] top-level scope at /root/.julia/packages/PkgTemplates/DXe8J/test/interactive/interactive.jl:2
   [11] include(::String) at ./client.jl:439
   [12] top-level scope at /root/.julia/packages/PkgTemplates/DXe8J/test/tests.jl:491
   [13] include(::String) at ./client.jl:439
   [14] macro expansion at /root/.julia/packages/PkgTemplates/DXe8J/test/runtests.jl:17 [inlined]
   [15] macro expansion at /buildworker/worker/package_linux64/build/usr/share/julia/stdlib/v1.4/Test/src/Test.jl:1110 [inlined]
   [16] (::var"#4#6")() at /root/.julia/packages/PkgTemplates/DXe8J/test/runtests.jl:17
   [17] cd(::var"#4#6", ::String) at ./file.jl:104
   [18] (::var"#3#5")(::String) at /root/.julia/packages/PkgTemplates/DXe8J/test/runtests.jl:15
   [19] mktempdir(::var"#3#5", ::String; prefix::String) at ./file.jl:669
   [20] mktempdir(::Function, ::String) at ./file.jl:667 (repeats 2 times)
   [21] top-level scope at /root/.julia/packages/PkgTemplates/DXe8J/test/runtests.jl:12
   [22] include(::String) at ./client.jl:439
   [23] top-level scope at none:6
   [24] eval(::Module, ::Any) at ./boot.jl:331
   [25] exec_options(::Base.JLOptions) at ./client.jl:264
   [26] _start() at ./client.jl:484
  
Coveralls: Error During Test at /root/.julia/packages/PkgTemplates/DXe8J/test/interactive/plugins.jl:65
  Got exception outside of a @test
  type IOStream has no field buffer
  Stacktrace:
   [1] getproperty(::IOStream, ::Symbol) at ./Base.jl:33
   [2] macro expansion at /root/.julia/packages/PkgTemplates/DXe8J/test/interactive/plugins.jl:66 [inlined]
   [3] macro expansion at /buildworker/worker/package_linux64/build/usr/share/julia/stdlib/v1.4/Test/src/Test.jl:1110 [inlined]
   [4] top-level scope at /root/.julia/packages/PkgTemplates/DXe8J/test/interactive/plugins.jl:66
   [5] include(::String) at ./client.jl:439
   [6] macro expansion at /root/.julia/packages/PkgTemplates/DXe8J/test/interactive/interactive.jl:66 [inlined]
   [7] macro expansion at /buildworker/worker/package_linux64/build/usr/share/julia/stdlib/v1.4/Test/src/Test.jl:1110 [inlined]
   [8] macro expansion at /root/.julia/packages/PkgTemplates/DXe8J/test/interactive/interactive.jl:66 [inlined]
   [9] macro expansion at /buildworker/worker/package_linux64/build/usr/share/julia/stdlib/v1.4/Test/src/Test.jl:1110 [inlined]
   [10] top-level scope at /root/.julia/packages/PkgTemplates/DXe8J/test/interactive/interactive.jl:2
   [11] include(::String) at ./client.jl:439
   [12] top-level scope at /root/.julia/packages/PkgTemplates/DXe8J/test/tests.jl:491
   [13] include(::String) at ./client.jl:439
   [14] macro expansion at /root/.julia/packages/PkgTemplates/DXe8J/test/runtests.jl:17 [inlined]
   [15] macro expansion at /buildworker/worker/package_linux64/build/usr/share/julia/stdlib/v1.4/Test/src/Test.jl:1110 [inlined]
   [16] (::var"#4#6")() at /root/.julia/packages/PkgTemplates/DXe8J/test/runtests.jl:17
   [17] cd(::var"#4#6", ::String) at ./file.jl:104
   [18] (::var"#3#5")(::String) at /root/.julia/packages/PkgTemplates/DXe8J/test/runtests.jl:15
   [19] mktempdir(::var"#3#5", ::String; prefix::String) at ./file.jl:669
   [20] mktempdir(::Function, ::String) at ./file.jl:667 (repeats 2 times)
   [21] top-level scope at /root/.julia/packages/PkgTemplates/DXe8J/test/runtests.jl:12
   [22] include(::String) at ./client.jl:439
   [23] top-level scope at none:6
   [24] eval(::Module, ::Any) at ./boot.jl:331
   [25] exec_options(::Base.JLOptions) at ./client.jl:264
   [26] _start() at ./client.jl:484
  
GitHubPages: Error During Test at /root/.julia/packages/PkgTemplates/DXe8J/test/interactive/plugins.jl:80
  Got exception outside of a @test
  type IOStream has no field buffer
  Stacktrace:
   [1] getproperty(::IOStream, ::Symbol) at ./Base.jl:33
   [2] macro expansion at /root/.julia/packages/PkgTemplates/DXe8J/test/interactive/plugins.jl:81 [inlined]
   [3] macro expansion at /buildworker/worker/package_linux64/build/usr/share/julia/stdlib/v1.4/Test/src/Test.jl:1110 [inlined]
   [4] top-level scope at /root/.julia/packages/PkgTemplates/DXe8J/test/interactive/plugins.jl:81
   [5] include(::String) at ./client.jl:439
   [6] macro expansion at /root/.julia/packages/PkgTemplates/DXe8J/test/interactive/interactive.jl:66 [inlined]
   [7] macro expansion at /buildworker/worker/package_linux64/build/usr/share/julia/stdlib/v1.4/Test/src/Test.jl:1110 [inlined]
   [8] macro expansion at /root/.julia/packages/PkgTemplates/DXe8J/test/interactive/interactive.jl:66 [inlined]
   [9] macro expansion at /buildworker/worker/package_linux64/build/usr/share/julia/stdlib/v1.4/Test/src/Test.jl:1110 [inlined]
   [10] top-level scope at /root/.julia/packages/PkgTemplates/DXe8J/test/interactive/interactive.jl:2
   [11] include(::String) at ./client.jl:439
   [12] top-level scope at /root/.julia/packages/PkgTemplates/DXe8J/test/tests.jl:491
   [13] include(::String) at ./client.jl:439
   [14] macro expansion at /root/.julia/packages/PkgTemplates/DXe8J/test/runtests.jl:17 [inlined]
   [15] macro expansion at /buildworker/worker/package_linux64/build/usr/share/julia/stdlib/v1.4/Test/src/Test.jl:1110 [inlined]
   [16] (::var"#4#6")() at /root/.julia/packages/PkgTemplates/DXe8J/test/runtests.jl:17
   [17] cd(::var"#4#6", ::String) at ./file.jl:104
   [18] (::var"#3#5")(::String) at /root/.julia/packages/PkgTemplates/DXe8J/test/runtests.jl:15
   [19] mktempdir(::var"#3#5", ::String; prefix::String) at ./file.jl:669
   [20] mktempdir(::Function, ::String) at ./file.jl:667 (repeats 2 times)
   [21] top-level scope at /root/.julia/packages/PkgTemplates/DXe8J/test/runtests.jl:12
   [22] include(::String) at ./client.jl:439
   [23] top-level scope at none:6
   [24] eval(::Module, ::Any) at ./boot.jl:331
   [25] exec_options(::Base.JLOptions) at ./client.jl:264
   [26] _start() at ./client.jl:484
  
Test Summary:                 | Pass  Error  Total
PkgTemplates.jl               |  323      9    332
  Template creation           |   21            21
  Show methods                |    2             2
  File generation             |   39            39
  Package generation          |   14      1     15
  Git-less template creation  |    1             1
  Git-less package generation |    2             2
  Version floor               |    4             4
  Mustache substitution       |   20            20
  License display             |   26            26
  Plugins                     |  176           176
  Documenter add kwargs       |   18            18
  Interactive mode            |           8      8
    Template creation         |           1      1
    Package generation        |           1      1
    Plugins                   |           6      6
      TravisCI                |           1      1
      AppVeyor                |           1      1
      GitLabCI                |           1      1
      Codecov                 |           1      1
      Coveralls               |           1      1
      GitHubPages             |           1      1
ERROR: LoadError: Some tests did not pass: 323 passed, 0 failed, 9 errored, 0 broken.
in expression starting at /root/.julia/packages/PkgTemplates/DXe8J/test/runtests.jl:12
ERROR: Package PkgTemplates errored during testing
Stacktrace:
 [1] pkgerror(::String, ::Vararg{String,N} where N) at /buildworker/worker/package_linux64/build/usr/share/julia/stdlib/v1.4/Pkg/src/Types.jl:53
 [2] test(::Pkg.Types.Context, ::Array{Pkg.Types.PackageSpec,1}; coverage::Bool, test_fn::Nothing, julia_args::Cmd, test_args::Cmd) at /buildworker/worker/package_linux64/build/usr/share/julia/stdlib/v1.4/Pkg/src/Operations.jl:1379
 [3] test(::Pkg.Types.Context, ::Array{Pkg.Types.PackageSpec,1}; coverage::Bool, test_fn::Nothing, julia_args::Cmd, test_args::Cmd, kwargs::Base.Iterators.Pairs{Union{},Union{},Tuple{},NamedTuple{(),Tuple{}}}) at /buildworker/worker/package_linux64/build/usr/share/julia/stdlib/v1.4/Pkg/src/API.jl:287
 [4] test(::Pkg.Types.Context, ::Array{Pkg.Types.PackageSpec,1}) at /buildworker/worker/package_linux64/build/usr/share/julia/stdlib/v1.4/Pkg/src/API.jl:274
 [5] #test#56 at /buildworker/worker/package_linux64/build/usr/share/julia/stdlib/v1.4/Pkg/src/API.jl:268 [inlined]
 [6] test at /buildworker/worker/package_linux64/build/usr/share/julia/stdlib/v1.4/Pkg/src/API.jl:268 [inlined]
 [7] #test#55 at /buildworker/worker/package_linux64/build/usr/share/julia/stdlib/v1.4/Pkg/src/API.jl:267 [inlined]
 [8] test at /buildworker/worker/package_linux64/build/usr/share/julia/stdlib/v1.4/Pkg/src/API.jl:267 [inlined]
 [9] test(::String; kwargs::Base.Iterators.Pairs{Union{},Union{},Tuple{},NamedTuple{(),Tuple{}}}) at /buildworker/worker/package_linux64/build/usr/share/julia/stdlib/v1.4/Pkg/src/API.jl:266
 [10] test(::String) at /buildworker/worker/package_linux64/build/usr/share/julia/stdlib/v1.4/Pkg/src/API.jl:266
 [11] top-level scope at none:10
