 Resolving package versions...
 Installed ProgressMeter ────── v1.2.0
 Installed OrderedCollections ─ v1.1.0
 Installed ACME ─────────────── v0.9.0
 Installed StaticArrays ─────── v0.11.1
 Installed IterTools ────────── v1.3.0
  Updating `~/.julia/environments/v1.0/Project.toml`
  [ca8b7239] + ACME v0.9.0
  Updating `~/.julia/environments/v1.0/Manifest.toml`
  [ca8b7239] + ACME v0.9.0
  [c8e1da08] + IterTools v1.3.0
  [bac558e1] + OrderedCollections v1.1.0
  [92933f4c] + ProgressMeter v1.2.0
  [90137ffa] + StaticArrays v0.11.1
  [2a0f44e3] + Base64 
  [8ba89e20] + Distributed 
  [b77e0a4c] + InteractiveUtils 
  [8f399da3] + Libdl 
  [37e2e46d] + LinearAlgebra 
  [56ddb016] + Logging 
  [d6f4376e] + Markdown 
  [de0858da] + Printf 
  [9a3f8284] + Random 
  [9e88b42a] + Serialization 
  [6462fe0b] + Sockets 
  [2f01184e] + SparseArrays 
  [10745b16] + Statistics 
  [8dfed614] + Test 
  [4ec0a83e] + Unicode 
   Testing ACME
 Resolving package versions...
 Installed VersionParsing ─ v1.1.3
 Installed Conda ────────── v1.3.0
 Installed FFTW ─────────── v1.1.0
 Installed Reexport ─────── v0.2.0
 Installed Parsers ──────── v0.3.10
 Installed AbstractFFTs ─── v0.5.0
 Installed JSON ─────────── v0.21.0
 Installed BinaryProvider ─ v0.5.8
 Installed Compat ───────── v2.2.0
  Building Conda → `~/.julia/packages/Conda/kLXeC/deps/build.log`
  Building FFTW ─→ `~/.julia/packages/FFTW/loJ3F/deps/build.log`
    Status `/tmp/tmpbeRiN8/Manifest.toml`
  [ca8b7239] ACME v0.9.0
  [621f4979] AbstractFFTs v0.5.0
  [b99e7846] BinaryProvider v0.5.8
  [34da2185] Compat v2.2.0
  [8f4d0f93] Conda v1.3.0
  [7a1cc6ca] FFTW v1.1.0
  [c8e1da08] IterTools v1.3.0
  [682c06a0] JSON v0.21.0
  [bac558e1] OrderedCollections v1.1.0
  [69de0a69] Parsers v0.3.10
  [92933f4c] ProgressMeter v1.2.0
  [189a3867] Reexport v0.2.0
  [90137ffa] StaticArrays v0.11.1
  [81def892] VersionParsing v1.1.3
  [2a0f44e3] Base64  [`@stdlib/Base64`]
  [ade2ca70] Dates  [`@stdlib/Dates`]
  [8bb1440f] DelimitedFiles  [`@stdlib/DelimitedFiles`]
  [8ba89e20] Distributed  [`@stdlib/Distributed`]
  [b77e0a4c] InteractiveUtils  [`@stdlib/InteractiveUtils`]
  [76f85450] LibGit2  [`@stdlib/LibGit2`]
  [8f399da3] Libdl  [`@stdlib/Libdl`]
  [37e2e46d] LinearAlgebra  [`@stdlib/LinearAlgebra`]
  [56ddb016] Logging  [`@stdlib/Logging`]
  [d6f4376e] Markdown  [`@stdlib/Markdown`]
  [a63ad114] Mmap  [`@stdlib/Mmap`]
  [44cfe95a] Pkg  [`@stdlib/Pkg`]
  [de0858da] Printf  [`@stdlib/Printf`]
  [3fa0cd96] REPL  [`@stdlib/REPL`]
  [9a3f8284] Random  [`@stdlib/Random`]
  [ea8e919c] SHA  [`@stdlib/SHA`]
  [9e88b42a] Serialization  [`@stdlib/Serialization`]
  [1a1011a3] SharedArrays  [`@stdlib/SharedArrays`]
  [6462fe0b] Sockets  [`@stdlib/Sockets`]
  [2f01184e] SparseArrays  [`@stdlib/SparseArrays`]
  [10745b16] Statistics  [`@stdlib/Statistics`]
  [8dfed614] Test  [`@stdlib/Test`]
  [cf7118a7] UUIDs  [`@stdlib/UUIDs`]
  [4ec0a83e] Unicode  [`@stdlib/Unicode`]
Checking copyright headers...
fatal: not a git repository (or any of the parent directories): .git
┌ Warning: ErrorException("failed process: Process(`git log --format=%cd --date=format:%Y -- /root/.julia/packages/ACME/IORoP/test/../src/ACME.jl`, ProcessExited(128)) [128]")
└ @ Main ~/.julia/packages/ACME/IORoP/test/checklic.jl:14
fatal: not a git repository (or any of the parent directories): .git
┌ Warning: ErrorException("failed process: Process(`git log --format=%cd --date=format:%Y -- /root/.julia/packages/ACME/IORoP/test/../src/circuit.jl`, ProcessExited(128)) [128]")
└ @ Main ~/.julia/packages/ACME/IORoP/test/checklic.jl:14
fatal: not a git repository (or any of the parent directories): .git
┌ Warning: ErrorException("failed process: Process(`git log --format=%cd --date=format:%Y -- /root/.julia/packages/ACME/IORoP/test/../src/deprecated.jl`, ProcessExited(128)) [128]")
└ @ Main ~/.julia/packages/ACME/IORoP/test/checklic.jl:14
fatal: not a git repository (or any of the parent directories): .git
┌ Warning: ErrorException("failed process: Process(`git log --format=%cd --date=format:%Y -- /root/.julia/packages/ACME/IORoP/test/../src/elements.jl`, ProcessExited(128)) [128]")
└ @ Main ~/.julia/packages/ACME/IORoP/test/checklic.jl:14
fatal: not a git repository (or any of the parent directories): .git
┌ Warning: ErrorException("failed process: Process(`git log --format=%cd --date=format:%Y -- /root/.julia/packages/ACME/IORoP/test/../src/kdtree.jl`, ProcessExited(128)) [128]")
└ @ Main ~/.julia/packages/ACME/IORoP/test/checklic.jl:14
fatal: not a git repository (or any of the parent directories): .git
┌ Warning: ErrorException("failed process: Process(`git log --format=%cd --date=format:%Y -- /root/.julia/packages/ACME/IORoP/test/../src/solvers.jl`, ProcessExited(128)) [128]")
└ @ Main ~/.julia/packages/ACME/IORoP/test/checklic.jl:14
fatal: not a git repository (or any of the parent directories): .git
┌ Warning: ErrorException("failed process: Process(`git log --format=%cd --date=format:%Y -- /root/.julia/packages/ACME/IORoP/test/../examples/birdie.jl`, ProcessExited(128)) [128]")
└ @ Main ~/.julia/packages/ACME/IORoP/test/checklic.jl:14
fatal: not a git repository (or any of the parent directories): .git
┌ Warning: ErrorException("failed process: Process(`git log --format=%cd --date=format:%Y -- /root/.julia/packages/ACME/IORoP/test/../examples/diodeclipper.jl`, ProcessExited(128)) [128]")
└ @ Main ~/.julia/packages/ACME/IORoP/test/checklic.jl:14
fatal: not a git repository (or any of the parent directories): .git
┌ Warning: ErrorException("failed process: Process(`git log --format=%cd --date=format:%Y -- /root/.julia/packages/ACME/IORoP/test/../examples/sallenkey.jl`, ProcessExited(128)) [128]")
└ @ Main ~/.julia/packages/ACME/IORoP/test/checklic.jl:14
fatal: not a git repository (or any of the parent directories): .git
┌ Warning: ErrorException("failed process: Process(`git log --format=%cd --date=format:%Y -- /root/.julia/packages/ACME/IORoP/test/../examples/superover.jl`, ProcessExited(128)) [128]")
└ @ Main ~/.julia/packages/ACME/IORoP/test/checklic.jl:14
fatal: not a git repository (or any of the parent directories): .git
┌ Warning: ErrorException("failed process: Process(`git log --format=%cd --date=format:%Y -- /root/.julia/packages/ACME/IORoP/test/../test/checklic.jl`, ProcessExited(128)) [128]")
└ @ Main ~/.julia/packages/ACME/IORoP/test/checklic.jl:14
fatal: not a git repository (or any of the parent directories): .git
┌ Warning: ErrorException("failed process: Process(`git log --format=%cd --date=format:%Y -- /root/.julia/packages/ACME/IORoP/test/../test/runtests.jl`, ProcessExited(128)) [128]")
└ @ Main ~/.julia/packages/ACME/IORoP/test/checklic.jl:14
Test Summary: | Pass  Total
topomat       |    3      3
Test Summary: | Pass  Total
LinearSolver  |   10     10
Running model:   5%|█▊                                  |  ETA: 0:00:05[KRunning model: 100%|████████████████████████████████████| Time: 0:00:00[K
Test Summary:   | Pass  Total
simple circuits |    3      3
Test Summary:        | Pass  Total
circuit manipulation |    9      9
Running model:  50%|██████████████████                  |  ETA: 0:00:01[KRunning model: 100%|████████████████████████████████████| Time: 0:00:00[K
Test Summary:   | Pass  Total
faulty circuits |    7      7
Test Summary: | Pass  Total
KDTree        | 1276   1276
Test Summary:  | Pass  Total
HomotopySolver |    2      2
Test Summary:           | Pass  Total
gensolve/rank_factorize |    2      2
Test Summary: | Pass  Total
redcue_pdims  |   28     28
Test Summary:              | Pass  Total
nonlinearity decomposition |    6      6
Test Summary:     | Pass  Total
composite_element |    4      4
Test Summary:  | Pass  Total
sources/probes |    6      6
Testing Gummel-Poon model:   0%|                        |  ETA: 0:01:54[KTesting Gummel-Poon model:   1%|▎                       |  ETA: 0:00:49[KTesting Gummel-Poon model:   2%|▍                       |  ETA: 0:02:31[KTesting Gummel-Poon model:   3%|▋                       |  ETA: 0:01:48[KTesting Gummel-Poon model:   3%|▊                       |  ETA: 0:01:31[KTesting Gummel-Poon model:   3%|▊                       |  ETA: 0:02:30[KTesting Gummel-Poon model:   4%|█                       |  ETA: 0:01:57[KTesting Gummel-Poon model:   5%|█▏                      |  ETA: 0:02:27[KTesting Gummel-Poon model:   6%|█▍                      |  ETA: 0:02:08[KTesting Gummel-Poon model:   7%|█▋                      |  ETA: 0:01:47[KTesting Gummel-Poon model:   8%|█▉                      |  ETA: 0:01:34[KTesting Gummel-Poon model:   9%|██▏                     |  ETA: 0:01:24[KTesting Gummel-Poon model:  10%|██▎                     |  ETA: 0:01:18[KTesting Gummel-Poon model:  10%|██▍                     |  ETA: 0:01:16[KTesting Gummel-Poon model:  11%|██▋                     |  ETA: 0:01:09[KTesting Gummel-Poon model:  12%|██▉                     |  ETA: 0:01:04[KTesting Gummel-Poon model:  12%|███                     |  ETA: 0:01:01[KTesting Gummel-Poon model:  13%|███▏                    |  ETA: 0:00:59[KTesting Gummel-Poon model:  14%|███▍                    |  ETA: 0:00:55[KTesting Gummel-Poon model:  15%|███▋                    |  ETA: 0:00:51[KTesting Gummel-Poon model:  16%|███▊                    |  ETA: 0:00:50[KTesting Gummel-Poon model:  16%|███▉                    |  ETA: 0:00:49[KTesting Gummel-Poon model:  17%|████▏                   |  ETA: 0:00:46[KTesting Gummel-Poon model:  17%|████▏                   |  ETA: 0:00:46[KTesting Gummel-Poon model:  18%|████▍                   |  ETA: 0:00:44[KTesting Gummel-Poon model:  19%|████▋                   |  ETA: 0:00:42[KTesting Gummel-Poon model:  20%|████▉                   |  ETA: 0:00:40[KTesting Gummel-Poon model:  21%|█████                   |  ETA: 0:00:39[KTesting Gummel-Poon model:  21%|█████▏                  |  ETA: 0:00:38[KTesting Gummel-Poon model:  22%|█████▍                  |  ETA: 0:00:36[KTesting Gummel-Poon model:  23%|█████▌                  |  ETA: 0:00:36[KTesting Gummel-Poon model:  24%|█████▋                  |  ETA: 0:00:34[KTesting Gummel-Poon model:  25%|█████▉                  |  ETA: 0:00:33[KTesting Gummel-Poon model:  25%|██████                  |  ETA: 0:00:40[KTesting Gummel-Poon model:  26%|██████▎                 |  ETA: 0:00:38[KTesting Gummel-Poon model:  27%|██████▍                 |  ETA: 0:00:44[KTesting Gummel-Poon model:  28%|██████▋                 |  ETA: 0:00:43[KTesting Gummel-Poon model:  28%|██████▊                 |  ETA: 0:00:47[KTesting Gummel-Poon model:  29%|███████                 |  ETA: 0:00:45[KTesting Gummel-Poon model:  30%|███████▏                |  ETA: 0:00:49[KTesting Gummel-Poon model:  31%|███████▍                |  ETA: 0:00:48[KTesting Gummel-Poon model:  31%|███████▌                |  ETA: 0:00:47[KTesting Gummel-Poon model:  32%|███████▋                |  ETA: 0:00:46[KTesting Gummel-Poon model:  33%|███████▉                |  ETA: 0:00:44[KTesting Gummel-Poon model:  33%|███████▉                |  ETA: 0:00:44[KTesting Gummel-Poon model:  34%|████████▏               |  ETA: 0:00:42[KTesting Gummel-Poon model:  35%|████████▍               |  ETA: 0:00:41[KTesting Gummel-Poon model:  35%|████████▌               |  ETA: 0:00:40[KTesting Gummel-Poon model:  36%|████████▋               |  ETA: 0:00:39[KTesting Gummel-Poon model:  37%|████████▊               |  ETA: 0:00:38[KTesting Gummel-Poon model:  37%|████████▉               |  ETA: 0:00:38[KTesting Gummel-Poon model:  38%|█████████▎              |  ETA: 0:00:36[KTesting Gummel-Poon model:  39%|█████████▍              |  ETA: 0:00:35[KTesting Gummel-Poon model:  40%|█████████▋              |  ETA: 0:00:34[KTesting Gummel-Poon model:  41%|█████████▉              |  ETA: 0:00:33[KTesting Gummel-Poon model:  42%|██████████              |  ETA: 0:00:32[KTesting Gummel-Poon model:  42%|██████████▏             |  ETA: 0:00:32[KTesting Gummel-Poon model:  43%|██████████▍             |  ETA: 0:00:30[KTesting Gummel-Poon model:  44%|██████████▌             |  ETA: 0:00:30[KTesting Gummel-Poon model:  45%|██████████▊             |  ETA: 0:00:29[KTesting Gummel-Poon model:  46%|██████████▉             |  ETA: 0:00:28[KTesting Gummel-Poon model:  46%|███████████▏            |  ETA: 0:00:27[KTesting Gummel-Poon model:  47%|███████████▎            |  ETA: 0:00:27[KTesting Gummel-Poon model:  48%|███████████▌            |  ETA: 0:00:26[KTesting Gummel-Poon model:  49%|███████████▋            |  ETA: 0:00:26[KTesting Gummel-Poon model:  49%|███████████▊            |  ETA: 0:00:25[KTesting Gummel-Poon model:  50%|████████████            |  ETA: 0:00:25[KTesting Gummel-Poon model:  50%|████████████            |  ETA: 0:00:27[KTesting Gummel-Poon model:  51%|████████████▎           |  ETA: 0:00:26[KTesting Gummel-Poon model:  52%|████████████▍           |  ETA: 0:00:27[KTesting Gummel-Poon model:  52%|████████████▌           |  ETA: 0:00:27[KTesting Gummel-Poon model:  53%|████████████▊           |  ETA: 0:00:26[KTesting Gummel-Poon model:  53%|████████████▊           |  ETA: 0:00:28[KTesting Gummel-Poon model:  54%|█████████████           |  ETA: 0:00:27[KTesting Gummel-Poon model:  55%|█████████████▏          |  ETA: 0:00:26[KTesting Gummel-Poon model:  55%|█████████████▏          |  ETA: 0:00:28[KTesting Gummel-Poon model:  56%|█████████████▍          |  ETA: 0:00:27[KTesting Gummel-Poon model:  56%|█████████████▌          |  ETA: 0:00:27[KTesting Gummel-Poon model:  57%|█████████████▊          |  ETA: 0:00:26[KTesting Gummel-Poon model:  58%|█████████████▉          |  ETA: 0:00:25[KTesting Gummel-Poon model:  59%|██████████████▏         |  ETA: 0:00:24[KTesting Gummel-Poon model:  60%|██████████████▎         |  ETA: 0:00:24[KTesting Gummel-Poon model:  60%|██████████████▌         |  ETA: 0:00:23[KTesting Gummel-Poon model:  61%|██████████████▋         |  ETA: 0:00:23[KTesting Gummel-Poon model:  61%|██████████████▊         |  ETA: 0:00:22[KTesting Gummel-Poon model:  62%|███████████████         |  ETA: 0:00:22[KTesting Gummel-Poon model:  63%|███████████████▎        |  ETA: 0:00:21[KTesting Gummel-Poon model:  64%|███████████████▍        |  ETA: 0:00:20[KTesting Gummel-Poon model:  65%|███████████████▌        |  ETA: 0:00:20[KTesting Gummel-Poon model:  65%|███████████████▊        |  ETA: 0:00:19[KTesting Gummel-Poon model:  66%|████████████████        |  ETA: 0:00:18[KTesting Gummel-Poon model:  67%|████████████████▏       |  ETA: 0:00:18[KTesting Gummel-Poon model:  68%|████████████████▎       |  ETA: 0:00:17[KTesting Gummel-Poon model:  69%|████████████████▌       |  ETA: 0:00:17[KTesting Gummel-Poon model:  69%|████████████████▋       |  ETA: 0:00:16[KTesting Gummel-Poon model:  70%|████████████████▊       |  ETA: 0:00:16[KTesting Gummel-Poon model:  71%|█████████████████       |  ETA: 0:00:15[KTesting Gummel-Poon model:  72%|█████████████████▎      |  ETA: 0:00:15[KTesting Gummel-Poon model:  73%|█████████████████▌      |  ETA: 0:00:14[KTesting Gummel-Poon model:  73%|█████████████████▋      |  ETA: 0:00:14[KTesting Gummel-Poon model:  74%|█████████████████▊      |  ETA: 0:00:13[KTesting Gummel-Poon model:  75%|██████████████████      |  ETA: 0:00:13[KTesting Gummel-Poon model:  75%|██████████████████      |  ETA: 0:00:13[KTesting Gummel-Poon model:  76%|██████████████████▎     |  ETA: 0:00:13[KTesting Gummel-Poon model:  77%|██████████████████▍     |  ETA: 0:00:13[KTesting Gummel-Poon model:  78%|██████████████████▋     |  ETA: 0:00:12[KTesting Gummel-Poon model:  78%|██████████████████▊     |  ETA: 0:00:12[KTesting Gummel-Poon model:  79%|███████████████████     |  ETA: 0:00:12[KTesting Gummel-Poon model:  80%|███████████████████▏    |  ETA: 0:00:12[KTesting Gummel-Poon model:  81%|███████████████████▍    |  ETA: 0:00:11[KTesting Gummel-Poon model:  81%|███████████████████▌    |  ETA: 0:00:11[KTesting Gummel-Poon model:  82%|███████████████████▊    |  ETA: 0:00:10[KTesting Gummel-Poon model:  83%|████████████████████    |  ETA: 0:00:10[KTesting Gummel-Poon model:  84%|████████████████████▏   |  ETA: 0:00:09[KTesting Gummel-Poon model:  85%|████████████████████▎   |  ETA: 0:00:09[KTesting Gummel-Poon model:  85%|████████████████████▌   |  ETA: 0:00:08[KTesting Gummel-Poon model:  86%|████████████████████▊   |  ETA: 0:00:08[KTesting Gummel-Poon model:  87%|████████████████████▉   |  ETA: 0:00:07[KTesting Gummel-Poon model:  88%|█████████████████████   |  ETA: 0:00:07[KTesting Gummel-Poon model:  88%|█████████████████████▎  |  ETA: 0:00:06[KTesting Gummel-Poon model:  88%|█████████████████████▎  |  ETA: 0:00:06[KTesting Gummel-Poon model:  89%|█████████████████████▌  |  ETA: 0:00:06[KTesting Gummel-Poon model:  90%|█████████████████████▋  |  ETA: 0:00:05[KTesting Gummel-Poon model:  91%|█████████████████████▊  |  ETA: 0:00:05[KTesting Gummel-Poon model:  92%|██████████████████████  |  ETA: 0:00:05[KTesting Gummel-Poon model:  92%|██████████████████████▏ |  ETA: 0:00:04[KTesting Gummel-Poon model:  93%|██████████████████████▎ |  ETA: 0:00:04[KTesting Gummel-Poon model:  94%|██████████████████████▌ |  ETA: 0:00:03[KTesting Gummel-Poon model:  94%|██████████████████████▌ |  ETA: 0:00:03[KTesting Gummel-Poon model:  95%|██████████████████████▊ |  ETA: 0:00:03[KTesting Gummel-Poon model:  96%|███████████████████████ |  ETA: 0:00:02[KTesting Gummel-Poon model:  96%|███████████████████████▏|  ETA: 0:00:02[KTesting Gummel-Poon model:  97%|███████████████████████▎|  ETA: 0:00:02[KTesting Gummel-Poon model:  98%|███████████████████████▌|  ETA: 0:00:01[KTesting Gummel-Poon model:  99%|███████████████████████▊|  ETA: 0:00:01[KTesting Gummel-Poon model:  99%|███████████████████████▊|  ETA: 0:00:00[KTesting Gummel-Poon model: 100%|████████████████████████| Time: 0:00:51[K
Test Summary: |   Pass   Total
BJT           | 102802  102802
Test Summary: | Pass  Total
MOSFET        |    2      2
Test Summary: | Pass  Total
op amp        |    4      4
Running sallenkey
Running diodeclipper
Running model:  36%|█████████████▏                      |  ETA: 0:00:00[KRunning model:  88%|███████████████████████████████▊    |  ETA: 0:00:00[KRunning model: 100%|████████████████████████████████████| Time: 0:00:00[K
Running birdie with fixed vol
Running model:  26%|█████████▍                          |  ETA: 0:00:00[KRunning model:  56%|████████████████████▏               |  ETA: 0:00:00[KRunning model: 100%|████████████████████████████████████| Time: 0:00:00[K
Running birdie with varying vol
Running superover with fixed potentiometer values
Running model:  19%|██████▊                             |  ETA: 0:00:00[KRunning model:  39%|██████████████▏                     |  ETA: 0:00:00[KRunning model:  61%|█████████████████████▉              |  ETA: 0:00:00[KRunning model:  80%|████████████████████████████▋       |  ETA: 0:00:00[KRunning model:  94%|██████████████████████████████████  |  ETA: 0:00:00[KRunning model: 100%|████████████████████████████████████| Time: 0:00:00[K
Running simplified superover with fixed potentiometer values
Running simplified, non-decomposed superover with fixed potentiometer values
Running model:  18%|██████▍                             |  ETA: 0:00:00[KRunning model:  37%|█████████████▎                      |  ETA: 0:00:00[KRunning model:  54%|███████████████████▌                |  ETA: 0:00:00[KRunning model:  71%|█████████████████████████▌          |  ETA: 0:00:00[KRunning model:  88%|███████████████████████████████▋    |  ETA: 0:00:00[KRunning model: 100%|████████████████████████████████████| Time: 0:00:00[K
Running superover with varying potentiometer values
Running simplified superover with varying potentiometer values
Test Summary: | Pass  Broken  Total
examples      |   31       2     33
   Testing ACME tests passed 
