 Resolving package versions...
 Installed InvertedIndices ───────────── v1.0.0
 Installed RecipesBase ───────────────── v0.7.0
 Installed PenaltyFunctions ──────────── v0.1.2
 Installed Parsers ───────────────────── v0.3.10
 Installed IteratorInterfaceExtensions ─ v1.0.0
 Installed Arpack ────────────────────── v0.3.1
 Installed BinaryProvider ────────────── v0.5.8
 Installed Pathogen ──────────────────── v0.3.1
 Installed Reexport ──────────────────── v0.2.0
 Installed DataAPI ───────────────────── v1.1.0
 Installed SweepOperator ─────────────── v0.3.0
 Installed JSON ──────────────────────── v0.21.0
 Installed BinDeps ───────────────────── v0.8.10
 Installed DataStructures ────────────── v0.17.6
 Installed SpecialFunctions ──────────── v0.8.0
 Installed DataValueInterfaces ───────── v1.0.0
 Installed URIParser ─────────────────── v0.4.0
 Installed ProgressMeter ─────────────── v1.2.0
 Installed Distances ─────────────────── v0.8.2
 Installed LossFunctions ─────────────── v0.5.1
 Installed PDMats ────────────────────── v0.9.10
 Installed OnlineStatsBase ───────────── v1.0.2
 Installed Distributions ─────────────── v0.21.8
 Installed DataFrames ────────────────── v0.19.4
 Installed SortingAlgorithms ─────────── v0.3.1
 Installed PooledArrays ──────────────── v0.5.2
 Installed Missings ──────────────────── v0.4.3
 Installed StatsBase ─────────────────── v0.32.0
 Installed OrderedCollections ────────── v1.1.0
 Installed TableTraits ───────────────── v1.0.0
 Installed CategoricalArrays ─────────── v0.7.3
 Installed QuadGK ────────────────────── v2.1.1
 Installed LearnBase ─────────────────── v0.2.2
 Installed Tables ────────────────────── v0.2.11
 Installed Rmath ─────────────────────── v0.5.1
 Installed StatsFuns ─────────────────── v0.9.0
 Installed OnlineStats ───────────────── v1.0.2
 Installed Compat ────────────────────── v2.2.0
  Updating `~/.julia/environments/v1.0/Project.toml`
  [c8189ad9] + Pathogen v0.3.1
  Updating `~/.julia/environments/v1.0/Manifest.toml`
  [7d9fca2a] + Arpack v0.3.1
  [9e28174c] + BinDeps v0.8.10
  [b99e7846] + BinaryProvider v0.5.8
  [324d7699] + CategoricalArrays v0.7.3
  [34da2185] + Compat v2.2.0
  [9a962f9c] + DataAPI v1.1.0
  [a93c6f00] + DataFrames v0.19.4
  [864edb3b] + DataStructures v0.17.6
  [e2d170a0] + DataValueInterfaces v1.0.0
  [b4f34e82] + Distances v0.8.2
  [31c24e10] + Distributions v0.21.8
  [41ab1584] + InvertedIndices v1.0.0
  [82899510] + IteratorInterfaceExtensions v1.0.0
  [682c06a0] + JSON v0.21.0
  [7f8f8fb0] + LearnBase v0.2.2
  [30fc2ffe] + LossFunctions v0.5.1
  [e1d29d7a] + Missings v0.4.3
  [a15396b6] + OnlineStats v1.0.2
  [925886fa] + OnlineStatsBase v1.0.2
  [bac558e1] + OrderedCollections v1.1.0
  [90014a1f] + PDMats v0.9.10
  [69de0a69] + Parsers v0.3.10
  [c8189ad9] + Pathogen v0.3.1
  [06bb1623] + PenaltyFunctions v0.1.2
  [2dfb63ee] + PooledArrays v0.5.2
  [92933f4c] + ProgressMeter v1.2.0
  [1fd47b50] + QuadGK v2.1.1
  [3cdcf5f2] + RecipesBase v0.7.0
  [189a3867] + Reexport v0.2.0
  [79098fc4] + Rmath v0.5.1
  [a2af1166] + SortingAlgorithms v0.3.1
  [276daf66] + SpecialFunctions v0.8.0
  [2913bbd2] + StatsBase v0.32.0
  [4c63d2b9] + StatsFuns v0.9.0
  [7522ee7d] + SweepOperator v0.3.0
  [3783bdb8] + TableTraits v1.0.0
  [bd369af6] + Tables v0.2.11
  [30578b45] + URIParser v0.4.0
  [2a0f44e3] + Base64 
  [ade2ca70] + Dates 
  [8bb1440f] + DelimitedFiles 
  [8ba89e20] + Distributed 
  [9fa8497b] + Future 
  [b77e0a4c] + InteractiveUtils 
  [76f85450] + LibGit2 
  [8f399da3] + Libdl 
  [37e2e46d] + LinearAlgebra 
  [56ddb016] + Logging 
  [d6f4376e] + Markdown 
  [a63ad114] + Mmap 
  [44cfe95a] + Pkg 
  [de0858da] + Printf 
  [3fa0cd96] + REPL 
  [9a3f8284] + Random 
  [ea8e919c] + SHA 
  [9e88b42a] + Serialization 
  [1a1011a3] + SharedArrays 
  [6462fe0b] + Sockets 
  [2f01184e] + SparseArrays 
  [10745b16] + Statistics 
  [4607b0f0] + SuiteSparse 
  [8dfed614] + Test 
  [cf7118a7] + UUIDs 
  [4ec0a83e] + Unicode 
  Building Arpack ──────────→ `~/.julia/packages/Arpack/cu5By/deps/build.log`
  Building SpecialFunctions → `~/.julia/packages/SpecialFunctions/ne2iw/deps/build.log`
  Building Rmath ───────────→ `~/.julia/packages/Rmath/4wt82/deps/build.log`
   Testing Pathogen
 Resolving package versions...
    Status `/tmp/tmpYm0hCd/Manifest.toml`
  [7d9fca2a] Arpack v0.3.1
  [9e28174c] BinDeps v0.8.10
  [b99e7846] BinaryProvider v0.5.8
  [324d7699] CategoricalArrays v0.7.3
  [34da2185] Compat v2.2.0
  [9a962f9c] DataAPI v1.1.0
  [a93c6f00] DataFrames v0.19.4
  [864edb3b] DataStructures v0.17.6
  [e2d170a0] DataValueInterfaces v1.0.0
  [b4f34e82] Distances v0.8.2
  [31c24e10] Distributions v0.21.8
  [41ab1584] InvertedIndices v1.0.0
  [82899510] IteratorInterfaceExtensions v1.0.0
  [682c06a0] JSON v0.21.0
  [7f8f8fb0] LearnBase v0.2.2
  [30fc2ffe] LossFunctions v0.5.1
  [e1d29d7a] Missings v0.4.3
  [a15396b6] OnlineStats v1.0.2
  [925886fa] OnlineStatsBase v1.0.2
  [bac558e1] OrderedCollections v1.1.0
  [90014a1f] PDMats v0.9.10
  [69de0a69] Parsers v0.3.10
  [c8189ad9] Pathogen v0.3.1
  [06bb1623] PenaltyFunctions v0.1.2
  [2dfb63ee] PooledArrays v0.5.2
  [92933f4c] ProgressMeter v1.2.0
  [1fd47b50] QuadGK v2.1.1
  [3cdcf5f2] RecipesBase v0.7.0
  [189a3867] Reexport v0.2.0
  [79098fc4] Rmath v0.5.1
  [a2af1166] SortingAlgorithms v0.3.1
  [276daf66] SpecialFunctions v0.8.0
  [2913bbd2] StatsBase v0.32.0
  [4c63d2b9] StatsFuns v0.9.0
  [7522ee7d] SweepOperator v0.3.0
  [3783bdb8] TableTraits v1.0.0
  [bd369af6] Tables v0.2.11
  [30578b45] URIParser v0.4.0
  [2a0f44e3] Base64  [`@stdlib/Base64`]
  [ade2ca70] Dates  [`@stdlib/Dates`]
  [8bb1440f] DelimitedFiles  [`@stdlib/DelimitedFiles`]
  [8ba89e20] Distributed  [`@stdlib/Distributed`]
  [9fa8497b] Future  [`@stdlib/Future`]
  [b77e0a4c] InteractiveUtils  [`@stdlib/InteractiveUtils`]
  [76f85450] LibGit2  [`@stdlib/LibGit2`]
  [8f399da3] Libdl  [`@stdlib/Libdl`]
  [37e2e46d] LinearAlgebra  [`@stdlib/LinearAlgebra`]
  [56ddb016] Logging  [`@stdlib/Logging`]
  [d6f4376e] Markdown  [`@stdlib/Markdown`]
  [a63ad114] Mmap  [`@stdlib/Mmap`]
  [44cfe95a] Pkg  [`@stdlib/Pkg`]
  [de0858da] Printf  [`@stdlib/Printf`]
  [3fa0cd96] REPL  [`@stdlib/REPL`]
  [9a3f8284] Random  [`@stdlib/Random`]
  [ea8e919c] SHA  [`@stdlib/SHA`]
  [9e88b42a] Serialization  [`@stdlib/Serialization`]
  [1a1011a3] SharedArrays  [`@stdlib/SharedArrays`]
  [6462fe0b] Sockets  [`@stdlib/Sockets`]
  [2f01184e] SparseArrays  [`@stdlib/SparseArrays`]
  [10745b16] Statistics  [`@stdlib/Statistics`]
  [4607b0f0] SuiteSparse  [`@stdlib/SuiteSparse`]
  [8dfed614] Test  [`@stdlib/Test`]
  [cf7118a7] UUIDs  [`@stdlib/UUIDs`]
  [4ec0a83e] Unicode  [`@stdlib/Unicode`]
┌ Warning: `getindex(df::DataFrame, col_ind::ColumnIndex)` is deprecated, use `df[!, col_ind]` instead.
│   caller = (::getfield(Main, Symbol("##3#4")))(::Tuple{Int64,Int64}) at none:0
└ @ Main ./none:0
┌ Warning: `getindex(df::DataFrame, col_ind::ColumnIndex)` is deprecated, use `df[!, col_ind]` instead.
│   caller = (::getfield(Main, Symbol("##3#4")))(::Tuple{Int64,Int64}) at none:0
└ @ Main ./none:0
┌ Warning: `getindex(df::DataFrame, col_ind::ColumnIndex)` is deprecated, use `df[!, col_ind]` instead.
│   caller = (::getfield(Main, Symbol("##3#4")))(::Tuple{Int64,Int64}) at none:0
└ @ Main ./none:0
┌ Warning: `getindex(df::DataFrame, col_ind::ColumnIndex)` is deprecated, use `df[!, col_ind]` instead.
│   caller = (::getfield(Main, Symbol("##3#4")))(::Tuple{Int64,Int64}) at none:0
└ @ Main ./none:0
┌ Warning: `getindex(df::DataFrame, col_ind::ColumnIndex)` is deprecated, use `df[!, col_ind]` instead.
│   caller = _coefficient(::Array{Float64,1}, ::Population, ::Int64) at risk_functions.jl:14
└ @ Main ~/.julia/packages/Pathogen/o7ZBj/test/risk_functions.jl:14
┌ Info: Simulating until: 
│ * a simulation time maximum of 100.0,
│ * an iteration maximum of 1000, or,
└ * a processing time maximum of Inf seconds.
[ Info: Simulation stopped: simulation time maximum reached
┌ Warning: `getindex(df::DataFrame, col_ind::ColumnIndex)` is deprecated, use `df[!, col_ind]` instead.
│   caller = _coefficient(::Array{Float64,1}, ::Population, ::Int64) at risk_functions.jl:14
└ @ Main ~/.julia/packages/Pathogen/o7ZBj/test/risk_functions.jl:14
┌ Warning: `getindex(df::DataFrame, col_ind::ColumnIndex)` is deprecated, use `df[!, col_ind]` instead.
│   caller = _coefficient(::Array{Float64,1}, ::Population, ::Int64) at risk_functions.jl:14
└ @ Main ~/.julia/packages/Pathogen/o7ZBj/test/risk_functions.jl:14
┌ Warning: `getindex(df::DataFrame, col_ind::ColumnIndex)` is deprecated, use `df[!, col_ind]` instead.
│   caller = _coefficient(::Array{Float64,1}, ::Population, ::Int64) at risk_functions.jl:14
└ @ Main ~/.julia/packages/Pathogen/o7ZBj/test/risk_functions.jl:14
Initialization progress  0%|▏                           |  ETA: 3:42:57[KInitialization progress  4%|█                           |  ETA: 0:20:07[KInitialization progress  4%|█▎                          |  ETA: 0:16:57[KInitialization progress  7%|██                          |  ETA: 0:10:14[KInitialization progress  9%|██▋                         |  ETA: 0:07:30[KInitialization progress 10%|██▉                         |  ETA: 0:06:43[KInitialization progress 13%|███▋                        |  ETA: 0:05:11[KInitialization progress 15%|████▎                       |  ETA: 0:04:18[KInitialization progress 18%|█████                       |  ETA: 0:03:33[KInitialization progress 20%|█████▊                      |  ETA: 0:03:04[KInitialization progress 21%|██████                      |  ETA: 0:02:53[KInitialization progress 22%|██████▎                     |  ETA: 0:02:44[KInitialization progress 24%|██████▉                     |  ETA: 0:02:27[KInitialization progress 26%|███████▎                    |  ETA: 0:02:15[KInitialization progress 28%|███████▊                    |  ETA: 0:02:05[KInitialization progress 29%|████████▎                   |  ETA: 0:01:55[KInitialization progress 31%|████████▋                   |  ETA: 0:01:47[KInitialization progress 33%|█████████▏                  |  ETA: 0:01:39[KInitialization progress 34%|█████████▋                  |  ETA: 0:01:32[KInitialization progress 36%|██████████▏                 |  ETA: 0:01:26[KInitialization progress 38%|██████████▌                 |  ETA: 0:01:20[KInitialization progress 39%|██████████▉                 |  ETA: 0:01:16[KInitialization progress 40%|███████████▎                |  ETA: 0:01:12[KInitialization progress 41%|███████████▍                |  ETA: 0:01:12[KInitialization progress 41%|███████████▌                |  ETA: 0:01:11[KInitialization progress 42%|███████████▋                |  ETA: 0:01:09[KInitialization progress 43%|████████████▏               |  ETA: 0:01:05[KInitialization progress 44%|████████████▍               |  ETA: 0:01:03[KInitialization progress 46%|████████████▊               |  ETA: 0:01:00[KInitialization progress 47%|█████████████▏              |  ETA: 0:00:57[KInitialization progress 50%|██████████████▏             |  ETA: 0:00:50[KInitialization progress 54%|███████████████             |  ETA: 0:00:44[KInitialization progress 56%|███████████████▋            |  ETA: 0:00:40[KInitialization progress 57%|████████████████            |  ETA: 0:00:38[KInitialization progress 59%|████████████████▍           |  ETA: 0:00:36[KInitialization progress 61%|█████████████████▏          |  ETA: 0:00:32[KInitialization progress 63%|█████████████████▊          |  ETA: 0:00:30[KInitialization progress 65%|██████████████████▎         |  ETA: 0:00:28[KInitialization progress 66%|██████████████████▌         |  ETA: 0:00:26[KInitialization progress 67%|██████████████████▊         |  ETA: 0:00:25[KInitialization progress 70%|███████████████████▌        |  ETA: 0:00:22[KInitialization progress 73%|████████████████████▌       |  ETA: 0:00:19[KInitialization progress 75%|█████████████████████       |  ETA: 0:00:17[KInitialization progress 77%|█████████████████████▌      |  ETA: 0:00:16[KInitialization progress 79%|██████████████████████▏     |  ETA: 0:00:14[KInitialization progress 80%|██████████████████████▍     |  ETA: 0:00:13[KInitialization progress 82%|███████████████████████     |  ETA: 0:00:11[KInitialization progress 83%|███████████████████████▍    |  ETA: 0:00:10[KInitialization progress 85%|███████████████████████▊    |  ETA: 0:00:09[KInitialization progress 87%|████████████████████████▎   |  ETA: 0:00:08[KInitialization progress 88%|████████████████████████▊   |  ETA: 0:00:07[KInitialization progress 91%|█████████████████████████▍  |  ETA: 0:00:05[KInitialization progress 93%|██████████████████████████▏ |  ETA: 0:00:04[KInitialization progress 96%|██████████████████████████▊ |  ETA: 0:00:02[KInitialization progress 96%|███████████████████████████ |  ETA: 0:00:02[KInitialization progress 97%|███████████████████████████▏|  ETA: 0:00:02[KInitialization progress 97%|███████████████████████████▏|  ETA: 0:00:02[KInitialization progress100%|████████████████████████████| Time: 0:00:54[K
MCMC progress  0%|▏                                     |  ETA: 2:12:08[KMCMC progress  1%|▍                                     |  ETA: 0:43:55[KMCMC progress  1%|▌                                     |  ETA: 0:33:03[KMCMC progress  2%|▉                                     |  ETA: 0:18:51[KMCMC progress  3%|█▏                                    |  ETA: 0:14:37[KMCMC progress  3%|█▎                                    |  ETA: 0:13:10[KMCMC progress  4%|█▍                                    |  ETA: 0:11:58[KMCMC progress  4%|█▌                                    |  ETA: 0:10:59[KMCMC progress  4%|█▋                                    |  ETA: 0:10:09[KMCMC progress  5%|██                                    |  ETA: 0:08:14[KMCMC progress  6%|██▏                                   |  ETA: 0:07:45[KMCMC progress  6%|██▎                                   |  ETA: 0:07:20[KMCMC progress  6%|██▍                                   |  ETA: 0:06:57[KMCMC progress  7%|██▌                                   |  ETA: 0:06:37[KMCMC progress  7%|██▋                                   |  ETA: 0:06:20[KMCMC progress  7%|██▊                                   |  ETA: 0:06:04[KMCMC progress  8%|██▉                                   |  ETA: 0:05:49[KMCMC progress  9%|███▎                                  |  ETA: 0:05:09[KMCMC progress 10%|███▋                                  |  ETA: 0:04:36[KMCMC progress 10%|███▊                                  |  ETA: 0:04:27[KMCMC progress 10%|███▉                                  |  ETA: 0:04:19[KMCMC progress 11%|████                                  |  ETA: 0:04:11[KMCMC progress 11%|████▏                                 |  ETA: 0:04:03[KMCMC progress 12%|████▌                                 |  ETA: 0:03:43[KMCMC progress 12%|████▋                                 |  ETA: 0:03:37[KMCMC progress 13%|████▉                                 |  ETA: 0:03:32[KMCMC progress 13%|█████                                 |  ETA: 0:03:27[KMCMC progress 13%|█████▏                                |  ETA: 0:03:22[KMCMC progress 14%|█████▎                                |  ETA: 0:03:18[KMCMC progress 14%|█████▍                                |  ETA: 0:03:14[KMCMC progress 14%|█████▌                                |  ETA: 0:03:09[KMCMC progress 15%|█████▋                                |  ETA: 0:03:05[KMCMC progress 15%|█████▊                                |  ETA: 0:03:01[KMCMC progress 15%|█████▉                                |  ETA: 0:02:57[KMCMC progress 16%|██████▏                               |  ETA: 0:02:49[KMCMC progress 16%|██████▎                               |  ETA: 0:02:46[KMCMC progress 17%|██████▍                               |  ETA: 0:02:42[KMCMC progress 17%|██████▌                               |  ETA: 0:02:40[KMCMC progress 17%|██████▋                               |  ETA: 0:02:37[KMCMC progress 18%|██████▊                               |  ETA: 0:02:34[KMCMC progress 18%|███████                               |  ETA: 0:02:29[KMCMC progress 19%|███████▏                              |  ETA: 0:02:27[KMCMC progress 19%|███████▎                              |  ETA: 0:02:25[KMCMC progress 19%|███████▍                              |  ETA: 0:02:23[KMCMC progress 20%|███████▋                              |  ETA: 0:02:18[KMCMC progress 20%|███████▊                              |  ETA: 0:02:15[KMCMC progress 21%|████████                              |  ETA: 0:02:11[KMCMC progress 21%|████████▏                             |  ETA: 0:02:09[KMCMC progress 22%|████████▍                             |  ETA: 0:02:05[KMCMC progress 22%|████████▌                             |  ETA: 0:02:03[KMCMC progress 23%|████████▋                             |  ETA: 0:02:01[KMCMC progress 23%|████████▊                             |  ETA: 0:02:00[KMCMC progress 24%|█████████▏                            |  ETA: 0:01:54[KMCMC progress 24%|█████████▎                            |  ETA: 0:01:53[KMCMC progress 25%|█████████▍                            |  ETA: 0:01:51[KMCMC progress 25%|█████████▌                            |  ETA: 0:01:49[KMCMC progress 25%|█████████▋                            |  ETA: 0:01:48[KMCMC progress 26%|█████████▉                            |  ETA: 0:01:45[KMCMC progress 27%|██████████▎                           |  ETA: 0:01:40[KMCMC progress 27%|██████████▍                           |  ETA: 0:01:39[KMCMC progress 28%|██████████▋                           |  ETA: 0:01:36[KMCMC progress 28%|██████████▊                           |  ETA: 0:01:35[KMCMC progress 29%|██████████▉                           |  ETA: 0:01:34[KMCMC progress 29%|███████████▏                          |  ETA: 0:01:31[KMCMC progress 30%|███████████▍                          |  ETA: 0:01:29[KMCMC progress 31%|███████████▊                          |  ETA: 0:01:25[KMCMC progress 31%|███████████▉                          |  ETA: 0:01:24[KMCMC progress 32%|████████████▏                         |  ETA: 0:01:22[KMCMC progress 32%|████████████▎                         |  ETA: 0:01:21[KMCMC progress 33%|████████████▌                         |  ETA: 0:01:19[KMCMC progress 34%|████████████▊                         |  ETA: 0:01:17[KMCMC progress 34%|████████████▉                         |  ETA: 0:01:16[KMCMC progress 34%|█████████████                         |  ETA: 0:01:15[KMCMC progress 35%|█████████████▏                        |  ETA: 0:01:14[KMCMC progress 35%|█████████████▎                        |  ETA: 0:01:13[KMCMC progress 35%|█████████████▍                        |  ETA: 0:01:12[KMCMC progress 36%|█████████████▌                        |  ETA: 0:01:12[KMCMC progress 36%|█████████████▊                        |  ETA: 0:01:10[KMCMC progress 37%|█████████████▉                        |  ETA: 0:01:09[KMCMC progress 37%|██████████████▏                       |  ETA: 0:01:08[KMCMC progress 38%|██████████████▍                       |  ETA: 0:01:07[KMCMC progress 38%|██████████████▋                       |  ETA: 0:01:05[KMCMC progress 39%|██████████████▊                       |  ETA: 0:01:04[KMCMC progress 39%|███████████████                       |  ETA: 0:01:03[KMCMC progress 40%|███████████████▏                      |  ETA: 0:01:02[KMCMC progress 40%|███████████████▎                      |  ETA: 0:01:02[KMCMC progress 40%|███████████████▍                      |  ETA: 0:01:01[KMCMC progress 41%|███████████████▌                      |  ETA: 0:01:01[KMCMC progress 41%|███████████████▋                      |  ETA: 0:01:00[KMCMC progress 42%|████████████████                      |  ETA: 0:00:58[KMCMC progress 42%|████████████████▏                     |  ETA: 0:00:57[KMCMC progress 43%|████████████████▍                     |  ETA: 0:00:56[KMCMC progress 44%|████████████████▊                     |  ETA: 0:00:54[KMCMC progress 44%|████████████████▉                     |  ETA: 0:00:54[KMCMC progress 45%|█████████████████                     |  ETA: 0:00:53[KMCMC progress 45%|█████████████████▏                    |  ETA: 0:00:53[KMCMC progress 45%|█████████████████▎                    |  ETA: 0:00:52[KMCMC progress 46%|█████████████████▍                    |  ETA: 0:00:52[KMCMC progress 46%|█████████████████▌                    |  ETA: 0:00:51[KMCMC progress 46%|█████████████████▋                    |  ETA: 0:00:51[KMCMC progress 47%|█████████████████▊                    |  ETA: 0:00:50[KMCMC progress 47%|█████████████████▉                    |  ETA: 0:00:50[KMCMC progress 47%|██████████████████                    |  ETA: 0:00:49[KMCMC progress 48%|██████████████████▍                   |  ETA: 0:00:48[KMCMC progress 49%|██████████████████▌                   |  ETA: 0:00:47[KMCMC progress 49%|██████████████████▋                   |  ETA: 0:00:47[KMCMC progress 49%|██████████████████▊                   |  ETA: 0:00:46[KMCMC progress 50%|██████████████████▉                   |  ETA: 0:00:46[KMCMC progress 50%|███████████████████                   |  ETA: 0:00:45[KMCMC progress 50%|███████████████████▏                  |  ETA: 0:00:45[KMCMC progress 51%|███████████████████▎                  |  ETA: 0:00:44[KMCMC progress 51%|███████████████████▍                  |  ETA: 0:00:44[KMCMC progress 51%|███████████████████▌                  |  ETA: 0:00:44[KMCMC progress 52%|███████████████████▋                  |  ETA: 0:00:43[KMCMC progress 52%|███████████████████▊                  |  ETA: 0:00:43[KMCMC progress 52%|███████████████████▉                  |  ETA: 0:00:42[KMCMC progress 53%|████████████████████                  |  ETA: 0:00:42[KMCMC progress 53%|████████████████████▏                 |  ETA: 0:00:42[KMCMC progress 53%|████████████████████▎                 |  ETA: 0:00:41[KMCMC progress 54%|████████████████████▍                 |  ETA: 0:00:41[KMCMC progress 55%|████████████████████▊                 |  ETA: 0:00:39[KMCMC progress 55%|████████████████████▉                 |  ETA: 0:00:39[KMCMC progress 55%|█████████████████████                 |  ETA: 0:00:39[KMCMC progress 56%|█████████████████████▏                |  ETA: 0:00:38[KMCMC progress 56%|█████████████████████▎                |  ETA: 0:00:38[KMCMC progress 56%|█████████████████████▍                |  ETA: 0:00:37[KMCMC progress 57%|█████████████████████▌                |  ETA: 0:00:37[KMCMC progress 57%|█████████████████████▋                |  ETA: 0:00:37[KMCMC progress 58%|██████████████████████                |  ETA: 0:00:35[KMCMC progress 58%|██████████████████████▏               |  ETA: 0:00:35[KMCMC progress 59%|██████████████████████▎               |  ETA: 0:00:34[KMCMC progress 59%|██████████████████████▍               |  ETA: 0:00:34[KMCMC progress 60%|██████████████████████▋               |  ETA: 0:00:33[KMCMC progress 60%|██████████████████████▊               |  ETA: 0:00:33[KMCMC progress 60%|██████████████████████▉               |  ETA: 0:00:33[KMCMC progress 61%|███████████████████████               |  ETA: 0:00:32[KMCMC progress 61%|███████████████████████▏              |  ETA: 0:00:32[KMCMC progress 62%|███████████████████████▍              |  ETA: 0:00:31[KMCMC progress 62%|███████████████████████▋              |  ETA: 0:00:30[KMCMC progress 63%|████████████████████████▏             |  ETA: 0:00:29[KMCMC progress 64%|████████████████████████▍             |  ETA: 0:00:28[KMCMC progress 65%|████████████████████████▋             |  ETA: 0:00:28[KMCMC progress 66%|█████████████████████████             |  ETA: 0:00:27[KMCMC progress 67%|█████████████████████████▍            |  ETA: 0:00:26[KMCMC progress 68%|█████████████████████████▊            |  ETA: 0:00:25[KMCMC progress 68%|██████████████████████████            |  ETA: 0:00:24[KMCMC progress 69%|██████████████████████████▏           |  ETA: 0:00:24[KMCMC progress 69%|██████████████████████████▎           |  ETA: 0:00:23[KMCMC progress 69%|██████████████████████████▍           |  ETA: 0:00:23[KMCMC progress 70%|██████████████████████████▌           |  ETA: 0:00:23[KMCMC progress 70%|██████████████████████████▋           |  ETA: 0:00:22[KMCMC progress 70%|██████████████████████████▊           |  ETA: 0:00:22[KMCMC progress 71%|███████████████████████████           |  ETA: 0:00:21[KMCMC progress 71%|███████████████████████████▏          |  ETA: 0:00:21[KMCMC progress 72%|███████████████████████████▍          |  ETA: 0:00:21[KMCMC progress 72%|███████████████████████████▌          |  ETA: 0:00:20[KMCMC progress 73%|███████████████████████████▊          |  ETA: 0:00:20[KMCMC progress 74%|████████████████████████████▏         |  ETA: 0:00:19[KMCMC progress 74%|████████████████████████████▎         |  ETA: 0:00:18[KMCMC progress 75%|████████████████████████████▍         |  ETA: 0:00:18[KMCMC progress 75%|████████████████████████████▌         |  ETA: 0:00:18[KMCMC progress 76%|████████████████████████████▉         |  ETA: 0:00:17[KMCMC progress 77%|█████████████████████████████▎        |  ETA: 0:00:16[KMCMC progress 78%|█████████████████████████████▌        |  ETA: 0:00:16[KMCMC progress 78%|█████████████████████████████▋        |  ETA: 0:00:15[KMCMC progress 78%|█████████████████████████████▊        |  ETA: 0:00:15[KMCMC progress 79%|█████████████████████████████▉        |  ETA: 0:00:15[KMCMC progress 79%|██████████████████████████████▏       |  ETA: 0:00:14[KMCMC progress 80%|██████████████████████████████▎       |  ETA: 0:00:14[KMCMC progress 80%|██████████████████████████████▌       |  ETA: 0:00:14[KMCMC progress 81%|██████████████████████████████▋       |  ETA: 0:00:13[KMCMC progress 81%|██████████████████████████████▊       |  ETA: 0:00:13[KMCMC progress 81%|██████████████████████████████▉       |  ETA: 0:00:13[KMCMC progress 82%|███████████████████████████████▎      |  ETA: 0:00:12[KMCMC progress 83%|███████████████████████████████▋      |  ETA: 0:00:11[KMCMC progress 84%|████████████████████████████████      |  ETA: 0:00:10[KMCMC progress 85%|████████████████████████████████▎     |  ETA: 0:00:10[KMCMC progress 85%|████████████████████████████████▍     |  ETA: 0:00:10[KMCMC progress 86%|████████████████████████████████▋     |  ETA: 0:00:09[KMCMC progress 86%|████████████████████████████████▊     |  ETA: 0:00:09[KMCMC progress 87%|█████████████████████████████████     |  ETA: 0:00:09[KMCMC progress 87%|█████████████████████████████████▏    |  ETA: 0:00:08[KMCMC progress 88%|█████████████████████████████████▍    |  ETA: 0:00:08[KMCMC progress 89%|█████████████████████████████████▊    |  ETA: 0:00:07[KMCMC progress 89%|██████████████████████████████████    |  ETA: 0:00:07[KMCMC progress 90%|██████████████████████████████████▎   |  ETA: 0:00:06[KMCMC progress 91%|██████████████████████████████████▋   |  ETA: 0:00:06[KMCMC progress 92%|███████████████████████████████████   |  ETA: 0:00:05[KMCMC progress 92%|███████████████████████████████████▏  |  ETA: 0:00:05[KMCMC progress 93%|███████████████████████████████████▎  |  ETA: 0:00:05[KMCMC progress 93%|███████████████████████████████████▍  |  ETA: 0:00:04[KMCMC progress 94%|███████████████████████████████████▋  |  ETA: 0:00:04[KMCMC progress 94%|███████████████████████████████████▉  |  ETA: 0:00:04[KMCMC progress 95%|████████████████████████████████████  |  ETA: 0:00:03[KMCMC progress 96%|████████████████████████████████████▍ |  ETA: 0:00:03[KMCMC progress 97%|████████████████████████████████████▊ |  ETA: 0:00:02[KMCMC progress 97%|█████████████████████████████████████ |  ETA: 0:00:02[KMCMC progress100%|██████████████████████████████████████| Time: 0:01:01[K
SEIR Model: Error During Test at /root/.julia/packages/Pathogen/o7ZBj/test/runtests.jl:22
  Got exception outside of a @test
  On worker 2:
  The input for CovMatrix is a Union{Tuple, AbstractArray{T,1} where T, NamedTuple}.  Found Float64.
  error at ./error.jl:33
  fit! at /root/.julia/packages/OnlineStatsBase/L6i9N/src/OnlineStatsBase.jl:108
  fit! at /root/.julia/packages/OnlineStatsBase/L6i9N/src/OnlineStatsBase.jl:110
  #iterate!#29 at /root/.julia/packages/Pathogen/o7ZBj/src/functions/iterate!.jl:66
  #iterate! at ./none:0
  #32 at /buildworker/worker/package_linux64/build/usr/share/julia/stdlib/v1.0/Distributed/src/macros.jl:43
  #109 at /buildworker/worker/package_linux64/build/usr/share/julia/stdlib/v1.0/Distributed/src/process_messages.jl:265
  run_work_thunk at /buildworker/worker/package_linux64/build/usr/share/julia/stdlib/v1.0/Distributed/src/process_messages.jl:56
  run_work_thunk at /buildworker/worker/package_linux64/build/usr/share/julia/stdlib/v1.0/Distributed/src/process_messages.jl:65
  #102 at ./task.jl:259
  Stacktrace:
   [1] #remotecall_fetch#149(::Base.Iterators.Pairs{Union{},Union{},Tuple{},NamedTuple{(),Tuple{}}}, ::Function, ::Function, ::Distributed.Worker, ::Distributed.RRID) at /buildworker/worker/package_linux64/build/usr/share/julia/stdlib/v1.0/Distributed/src/remotecall.jl:379
   [2] remotecall_fetch(::Function, ::Distributed.Worker, ::Distributed.RRID, ::Vararg{Any,N} where N) at /buildworker/worker/package_linux64/build/usr/share/julia/stdlib/v1.0/Distributed/src/remotecall.jl:371
   [3] #remotecall_fetch#152 at /buildworker/worker/package_linux64/build/usr/share/julia/stdlib/v1.0/Distributed/src/remotecall.jl:406 [inlined]
   [4] remotecall_fetch at /buildworker/worker/package_linux64/build/usr/share/julia/stdlib/v1.0/Distributed/src/remotecall.jl:406 [inlined]
   [5] call_on_owner at /buildworker/worker/package_linux64/build/usr/share/julia/stdlib/v1.0/Distributed/src/remotecall.jl:479 [inlined]
   [6] fetch(::Future) at /buildworker/worker/package_linux64/build/usr/share/julia/stdlib/v1.0/Distributed/src/remotecall.jl:511
   [7] iterate at ./generator.jl:47 [inlined]
   [8] collect(::Base.Generator{Array{Future,1},typeof(fetch)}) at ./array.jl:619
   [9] #iterate!#30(::Bool, ::Int64, ::Int64, ::Function, ::MCMC{SEIR}, ::Int64, ::Array{Float64,2}, ::Float64) at /root/.julia/packages/Pathogen/o7ZBj/src/functions/iterate!.jl:104
   [10] #iterate! at /root/.julia/packages/Pathogen/o7ZBj/src/functions/iterate!.jl:0 [inlined]
   [11] #iterate!#38(::Bool, ::Int64, ::Int64, ::Function, ::MCMC{SEIR}, ::Int64, ::Float64) at /root/.julia/packages/Pathogen/o7ZBj/src/functions/iterate!.jl:132
   [12] iterate!(::MCMC{SEIR}, ::Int64, ::Float64) at /root/.julia/packages/Pathogen/o7ZBj/src/functions/iterate!.jl:132
   [13] macro expansion at /root/.julia/packages/Pathogen/o7ZBj/test/runtests.jl:87 [inlined]
   [14] macro expansion at /buildworker/worker/package_linux64/build/usr/share/julia/stdlib/v1.0/Test/src/Test.jl:1083 [inlined]
   [15] top-level scope at /root/.julia/packages/Pathogen/o7ZBj/test/runtests.jl:25
   [16] include at ./boot.jl:317 [inlined]
   [17] include_relative(::Module, ::String) at ./loading.jl:1044
   [18] include(::Module, ::String) at ./sysimg.jl:29
   [19] include(::String) at ./client.jl:392
   [20] top-level scope at none:0
   [21] eval(::Module, ::Any) at ./boot.jl:319
   [22] exec_options(::Base.JLOptions) at ./client.jl:243
   [23] _start() at ./client.jl:425
Test Summary: | Pass  Error  Total
SEIR Model    |  222      1    223
ERROR: LoadError: Some tests did not pass: 222 passed, 0 failed, 1 errored, 0 broken.
in expression starting at /root/.julia/packages/Pathogen/o7ZBj/test/runtests.jl:22
ERROR: Package Pathogen errored during testing
Stacktrace:
 [1] pkgerror(::String, ::Vararg{String,N} where N) at /buildworker/worker/package_linux64/build/usr/share/julia/stdlib/v1.0/Pkg/src/Types.jl:120
 [2] #test#65(::Bool, ::Function, ::Pkg.Types.Context, ::Array{Pkg.Types.PackageSpec,1}) at /buildworker/worker/package_linux64/build/usr/share/julia/stdlib/v1.0/Pkg/src/Operations.jl:1357
 [3] #test at /buildworker/worker/package_linux64/build/usr/share/julia/stdlib/v1.0/Pkg/src/API.jl:0 [inlined]
 [4] #test#44(::Bool, ::Base.Iterators.Pairs{Union{},Union{},Tuple{},NamedTuple{(),Tuple{}}}, ::Function, ::Pkg.Types.Context, ::Array{Pkg.Types.PackageSpec,1}) at /buildworker/worker/package_linux64/build/usr/share/julia/stdlib/v1.0/Pkg/src/API.jl:278
 [5] test at /buildworker/worker/package_linux64/build/usr/share/julia/stdlib/v1.0/Pkg/src/API.jl:263 [inlined]
 [6] #test#43 at /buildworker/worker/package_linux64/build/usr/share/julia/stdlib/v1.0/Pkg/src/API.jl:260 [inlined]
 [7] test at /buildworker/worker/package_linux64/build/usr/share/julia/stdlib/v1.0/Pkg/src/API.jl:260 [inlined]
 [8] #test#42 at /buildworker/worker/package_linux64/build/usr/share/julia/stdlib/v1.0/Pkg/src/API.jl:259 [inlined]
 [9] test at /buildworker/worker/package_linux64/build/usr/share/julia/stdlib/v1.0/Pkg/src/API.jl:259 [inlined]
 [10] #test#41 at /buildworker/worker/package_linux64/build/usr/share/julia/stdlib/v1.0/Pkg/src/API.jl:258 [inlined]
 [11] test(::String) at /buildworker/worker/package_linux64/build/usr/share/julia/stdlib/v1.0/Pkg/src/API.jl:258
 [12] top-level scope at none:0
