 Resolving package versions...
 Installed Missings ─────────────── v0.4.3
 Installed SortingAlgorithms ────── v0.3.1
 Installed Calculus ─────────────── v0.5.1
 Installed TravelingSalesmanExact ─ v0.3.2
 Installed DiffResults ──────────── v0.0.4
 Installed BinDeps ──────────────── v0.8.10
 Installed JSON ─────────────────── v0.21.0
 Installed ForwardDiff ──────────── v0.10.6
 Installed URIParser ────────────── v0.4.0
 Installed DiffRules ────────────── v0.1.0
 Installed Parsers ──────────────── v0.3.10
 Installed DataAPI ──────────────── v1.1.0
 Installed DataStructures ───────── v0.17.6
 Installed StaticArrays ─────────── v0.12.1
 Installed BenchmarkTools ───────── v0.4.3
 Installed CommonSubexpressions ─── v0.2.0
 Installed NaNMath ──────────────── v0.3.3
 Installed OrderedCollections ───── v1.1.0
 Installed StatsBase ────────────── v0.32.0
 Installed MathOptInterface ─────── v0.9.7
 Installed BinaryProvider ───────── v0.5.8
 Installed SpecialFunctions ─────── v0.8.0
 Installed Compat ───────────────── v2.2.0
 Installed UnicodePlots ─────────── v1.1.0
 Installed JuMP ─────────────────── v0.20.1
  Updating `~/.julia/environments/v1.4/Project.toml`
  [737fac7d] + TravelingSalesmanExact v0.3.2
  Updating `~/.julia/environments/v1.4/Manifest.toml`
  [6e4b80f9] + BenchmarkTools v0.4.3
  [9e28174c] + BinDeps v0.8.10
  [b99e7846] + BinaryProvider v0.5.8
  [49dc2e85] + Calculus v0.5.1
  [bbf7d656] + CommonSubexpressions v0.2.0
  [34da2185] + Compat v2.2.0
  [9a962f9c] + DataAPI v1.1.0
  [864edb3b] + DataStructures v0.17.6
  [163ba53b] + DiffResults v0.0.4
  [b552c78f] + DiffRules v0.1.0
  [f6369f11] + ForwardDiff v0.10.6
  [682c06a0] + JSON v0.21.0
  [4076af6c] + JuMP v0.20.1
  [b8f27783] + MathOptInterface v0.9.7
  [e1d29d7a] + Missings v0.4.3
  [77ba4419] + NaNMath v0.3.3
  [bac558e1] + OrderedCollections v1.1.0
  [69de0a69] + Parsers v0.3.10
  [a2af1166] + SortingAlgorithms v0.3.1
  [276daf66] + SpecialFunctions v0.8.0
  [90137ffa] + StaticArrays v0.12.1
  [2913bbd2] + StatsBase v0.32.0
  [737fac7d] + TravelingSalesmanExact v0.3.2
  [30578b45] + URIParser v0.4.0
  [b8865327] + UnicodePlots v1.1.0
  [2a0f44e3] + Base64 
  [ade2ca70] + Dates 
  [8bb1440f] + DelimitedFiles 
  [8ba89e20] + Distributed 
  [b77e0a4c] + InteractiveUtils 
  [76f85450] + LibGit2 
  [8f399da3] + Libdl 
  [37e2e46d] + LinearAlgebra 
  [56ddb016] + Logging 
  [d6f4376e] + Markdown 
  [a63ad114] + Mmap 
  [44cfe95a] + Pkg 
  [de0858da] + Printf 
  [3fa0cd96] + REPL 
  [9a3f8284] + Random 
  [ea8e919c] + SHA 
  [9e88b42a] + Serialization 
  [1a1011a3] + SharedArrays 
  [6462fe0b] + Sockets 
  [2f01184e] + SparseArrays 
  [10745b16] + Statistics 
  [8dfed614] + Test 
  [cf7118a7] + UUIDs 
  [4ec0a83e] + Unicode 
  Building SpecialFunctions → `~/.julia/packages/SpecialFunctions/ne2iw/deps/build.log`
   Testing TravelingSalesmanExact
 Resolving package versions...
 Installed GLPK ─ v0.12.0
  Building GLPK → `~/.julia/packages/GLPK/J1b5G/deps/build.log`
Status `/tmp/jl_TBsNrk/Manifest.toml`
  [6e4b80f9] BenchmarkTools v0.4.3
  [9e28174c] BinDeps v0.8.10
  [b99e7846] BinaryProvider v0.5.8
  [49dc2e85] Calculus v0.5.1
  [bbf7d656] CommonSubexpressions v0.2.0
  [34da2185] Compat v2.2.0
  [9a962f9c] DataAPI v1.1.0
  [864edb3b] DataStructures v0.17.6
  [163ba53b] DiffResults v0.0.4
  [b552c78f] DiffRules v0.1.0
  [f6369f11] ForwardDiff v0.10.6
  [60bf3e95] GLPK v0.12.0
  [682c06a0] JSON v0.21.0
  [4076af6c] JuMP v0.20.1
  [b8f27783] MathOptInterface v0.9.7
  [e1d29d7a] Missings v0.4.3
  [77ba4419] NaNMath v0.3.3
  [bac558e1] OrderedCollections v1.1.0
  [69de0a69] Parsers v0.3.10
  [a2af1166] SortingAlgorithms v0.3.1
  [276daf66] SpecialFunctions v0.8.0
  [90137ffa] StaticArrays v0.12.1
  [2913bbd2] StatsBase v0.32.0
  [737fac7d] TravelingSalesmanExact v0.3.2
  [30578b45] URIParser v0.4.0
  [b8865327] UnicodePlots v1.1.0
  [2a0f44e3] Base64  [`@stdlib/Base64`]
  [ade2ca70] Dates  [`@stdlib/Dates`]
  [8bb1440f] DelimitedFiles  [`@stdlib/DelimitedFiles`]
  [8ba89e20] Distributed  [`@stdlib/Distributed`]
  [b77e0a4c] InteractiveUtils  [`@stdlib/InteractiveUtils`]
  [76f85450] LibGit2  [`@stdlib/LibGit2`]
  [8f399da3] Libdl  [`@stdlib/Libdl`]
  [37e2e46d] LinearAlgebra  [`@stdlib/LinearAlgebra`]
  [56ddb016] Logging  [`@stdlib/Logging`]
  [d6f4376e] Markdown  [`@stdlib/Markdown`]
  [a63ad114] Mmap  [`@stdlib/Mmap`]
  [44cfe95a] Pkg  [`@stdlib/Pkg`]
  [de0858da] Printf  [`@stdlib/Printf`]
  [3fa0cd96] REPL  [`@stdlib/REPL`]
  [9a3f8284] Random  [`@stdlib/Random`]
  [ea8e919c] SHA  [`@stdlib/SHA`]
  [9e88b42a] Serialization  [`@stdlib/Serialization`]
  [1a1011a3] SharedArrays  [`@stdlib/SharedArrays`]
  [6462fe0b] Sockets  [`@stdlib/Sockets`]
  [2f01184e] SparseArrays  [`@stdlib/SparseArrays`]
  [10745b16] Statistics  [`@stdlib/Statistics`]
  [8dfed614] Test  [`@stdlib/Test`]
  [cf7118a7] UUIDs  [`@stdlib/UUIDs`]
  [4ec0a83e] Unicode  [`@stdlib/Unicode`]
NAME : att48
COMMENT : 48 capitals of the US (Padberg/Rinaldi)
TYPE : TSP
DIMENSION : 48
EDGE_WEIGHT_TYPE : ATT
NODE_COORD_SECTION
EOF
┌ Info: Starting optimization.
│   plot_cities(cities) =
│            ┌────────────────────────────────────────┐ 
│       6000 │⠀⠀⠀⠀⠀⠀⠀⠀⠀⠀⠀⠀⠀⠀⠀⠀⠀⠀⠀⠀⠀⠀⠀⠀⠀⠀⠀⠀⠀⠀⠀⠀⠀⠀⠀⠀⠀⠀⠀⠀│ 
│            │⠀⠀⠀⠀⠀⠀⠀⠀⠀⠀⠀⠀⠀⠀⠀⠀⠀⠀⠀⠀⠀⠀⠀⠀⠀⠀⠀⠀⠀⠀⠀⠀⠀⠀⠀⠀⠀⠀⠀⠀│ 
│            │⠀⠀⠀⠀⠀⠀⠀⠀⠀⠀⠀⠀⠀⠀⠀⠀⠀⠀⠀⠀⠀⠀⠀⠀⠀⠀⠀⠀⠀⠀⠀⠀⠀⠀⠀⠀⡀⢰⠃⠀│ 
│            │⠀⠀⠀⠀⠀⠀⠀⠀⠀⠀⠀⠀⠀⠀⠀⠀⠀⠀⠀⠀⠀⠀⠀⠀⠀⠀⠀⠀⠀⠀⠀⠀⢀⡠⣒⠝⣻⢿⣺⠀│ 
│            │⠀⠀⠀⠀⠀⠀⠀⠀⠀⠀⠀⠀⠀⠀⠀⠀⠀⠀⠀⠀⠀⠀⠀⠀⠀⠀⠀⠀⠀⢀⢤⠮⠓⣉⣴⠮⣾⣽⡟⠀│ 
│            │⠀⠀⠀⠀⠀⠀⠀⠀⠀⠀⠀⠀⠀⠀⠀⠀⠀⠀⠀⠀⠀⠀⠀⠀⠀⠀⣀⡴⠞⠋⡡⣔⣞⣊⡠⣴⠝⣿⡇⠀│ 
│            │⠀⠀⠀⠀⠀⠀⠀⠀⠀⠀⠀⠀⠀⠀⠀⠀⢤⣀⣀⣀⣀⣀⣤⣤⣶⣺⣷⣞⣻⢟⠝⠉⢀⠤⢊⣇⣀⣿⠁⠀│ 
│            │⠀⠀⠀⠀⠀⠀⠀⠀⣀⣀⣀⣀⣀⣀⣀⣤⣤⣤⣴⣶⣮⣿⣛⣿⣻⡷⠶⣿⣿⣯⣭⠿⠿⢿⣝⣀⣀⣿⠀⠀│ 
│            │⠒⠒⠛⠉⢉⣉⣉⠭⠭⠛⠛⠛⠛⠓⠤⠤⣤⣴⣛⣩⣟⣛⣶⡾⣿⣭⠯⡷⣝⣽⣥⣲⠀⢰⠁⠀⠀⡇⠀⠀│ 
│            │⠲⠶⠭⣉⣁⢀⣀⣠⣤⣤⣤⣔⣒⣶⠶⢋⠭⢛⣩⠽⠛⠋⢑⣷⢾⠼⢿⡹⠓⠒⠤⡎⢉⠏⠉⠒⢺⠃⠀⠀│ 
│            │⠀⠀⠀⠀⠀⠉⠉⠑⢒⡢⣴⠾⣊⣤⠝⡻⠝⠛⠛⠛⢫⢽⡭⠯⢍⣩⣋⣹⣍⢉⠏⡗⡞⠒⠲⡀⢸⠀⠀⠀│ 
│            │⠀⠀⠀⠀⠀⣀⢤⡪⣥⣚⠾⠽⢖⡊⠉⠉⠑⠒⣢⣴⣵⣁⣠⡤⠮⣤⡴⠖⡩⢫⣩⣻⠷⠒⠀⠑⡇⠀⠀⠀│ 
│            │⠀⠀⣀⣶⡿⠿⠯⠭⠤⠒⠒⠒⠒⠊⠙⠫⣭⡟⠊⠀⢀⡠⠤⢓⣉⠤⠔⡖⠉⠉⢹⠇⠀⠀⠀⠀⠀⠀⠀⠀│ 
│            │⠀⠀⠀⠀⠀⠀⠀⠀⠀⠀⠀⠀⠀⠀⠀⠈⣀⢬⣓⠾⠵⣒⠉⠁⠀⢀⠜⠀⠀⠀⠘⠀⠀⠀⠀⠀⠀⠀⠀⠀│ 
│          0 │⠀⠀⠀⠀⠀⠀⠀⠀⠀⠀⠀⣀⡠⠴⠚⠛⠉⠁⠀⠀⠀⠀⠉⠒⠤⠊⠀⠀⠀⠀⠀⠀⠀⠀⠀⠀⠀⠀⠀⠀│ 
│            └────────────────────────────────────────┘ 
└            0                                     8000
┌ Info: Iteration 1 took 26.989s, disallowed 5 cycles.
│   plot_tour(cities, value.(tour_matrix)) =
│            ┌────────────────────────────────────────┐ 
│       6000 │⠀⠀⠀⠀⠀⠀⠀⠀⠀⠀⠀⠀⠀⠀⠀⠀⠀⠀⠀⠀⠀⠀⠀⠀⠀⠀⠀⠀⠀⠀⠀⠀⠀⠀⠀⠀⠀⠀⠀⠀│ 
│            │⠀⠀⠀⠀⠀⠀⠀⠀⠀⠀⠀⠀⠀⠀⠀⠀⠀⠀⠀⠀⠀⠀⠀⠀⠀⠀⠀⠀⠀⠀⠀⠀⠀⠀⠀⠀⠀⠀⠀⠀│ 
│            │⠀⠀⠀⠀⠀⠀⠀⠀⠀⠀⠀⠀⠀⠀⠀⠀⠀⠀⠀⠀⠀⠀⠀⠀⠀⠀⠀⠀⠀⠀⠀⠀⠀⠀⠀⠀⡀⢰⠁⠀│ 
│            │⠀⠀⠀⠀⠀⠀⠀⠀⠀⠀⠀⠀⠀⠀⠀⠀⠀⠀⠀⠀⠀⠀⠀⠀⠀⠀⠀⠀⠀⠀⠀⠀⠀⠀⢀⠔⠹⣎⡽⠀│ 
│            │⠀⠀⠀⠀⠀⠀⠀⠀⠀⠀⠀⠀⠀⠀⠀⠀⠀⠀⠀⠀⠀⠀⠀⠀⠀⠀⠀⠀⠀⠀⠀⠀⠀⢠⠊⠀⢰⠁⠀⠀│ 
│            │⠀⠀⠀⠀⠀⠀⠀⠀⠀⠀⠀⠀⠀⠀⠀⠀⠀⠀⠀⠀⠀⠀⠀⠀⠀⠀⠀⠀⠀⠀⠀⠀⡔⠁⠀⠀⠗⢹⠀⠀│ 
│            │⠀⠀⠀⠀⠀⠀⠀⠀⠀⠀⠀⠀⠀⠀⢀⣀⡄⠀⠀⠀⠀⠀⢤⠤⢄⣀⡠⠤⠒⠉⢢⢎⠀⠀⡠⠔⠊⣁⠀⠀│ 
│            │⠀⠀⠀⠀⠀⠀⠀⠀⣀⡠⠤⠔⠒⠉⠁⠀⠘⡄⠀⠀⠀⠀⠘⡄⠀⠀⠀⠀⠀⣰⣁⡠⠝⠛⠔⠒⠉⢸⠀⠀│ 
│            │⡖⠤⡀⠀⠀⠀⢀⠎⠀⠀⠀⠀⠀⠀⠀⠀⡰⠁⠀⠀⠀⠀⣀⠕⣀⡠⠤⢖⡯⠒⠉⢱⠀⠀⠀⠀⠀⡜⠀⠀│ 
│            │⡇⠀⠈⠑⠢⢤⠃⠀⠀⠀⠀⠀⠀⠀⠀⡰⠁⣀⣀⠤⠔⠚⠪⣉⡠⠤⡪⠃⠀⠀⠀⢎⣀⠀⠀⠀⢰⠁⠀⠀│ 
│            │⢸⠀⠀⠀⠀⠀⠀⠀⠀⠀⢀⣀⠤⠔⠒⡏⠉⠀⠀⠀⠀⠀⠀⠀⢀⠜⠀⠀⠀⠀⠀⠀⠀⠉⡆⠀⢸⠀⠀⠀│ 
│            │⠀⡇⠀⠀⠀⢀⡠⠔⠊⠉⠁⠀⠀⠀⠀⢱⠀⠀⠀⠀⠀⠀⠀⣠⣃⡠⠤⠔⠤⣀⠀⠀⠀⠘⠢⠤⡎⠀⠀⠀│ 
│            │⠀⠸⡠⠖⠊⠁⠀⠀⠀⠀⠀⠀⠀⠀⠀⢸⠀⠀⠀⠀⠀⠀⠀⠁⠀⠀⠀⠀⠀⠀⢹⠀⠀⠀⠀⠀⠀⠀⠀⠀│ 
│            │⠀⠀⠀⠀⠀⠀⠀⠀⠀⠀⠀⠀⠀⢀⡠⠊⠀⠀⠀⠀⠀⠀⠀⠀⠀⠀⠀⠀⣀⠤⠚⠀⠀⠀⠀⠀⠀⠀⠀⠀│ 
│          0 │⠀⠀⠀⠀⠀⠀⠀⠀⠀⠀⠀⣀⣔⣁⣀⣀⣀⣀⣀⣀⡠⠤⠤⠤⠤⠤⠒⠉⠀⠀⠀⠀⠀⠀⠀⠀⠀⠀⠀⠀│ 
│            └────────────────────────────────────────┘ 
└            0                                     8000
┌ Info: Iteration 2 took 0.006s, disallowed 6 cycles.
│   plot_tour(cities, value.(tour_matrix)) =
│            ┌────────────────────────────────────────┐ 
│       6000 │⠀⠀⠀⠀⠀⠀⠀⠀⠀⠀⠀⠀⠀⠀⠀⠀⠀⠀⠀⠀⠀⠀⠀⠀⠀⠀⠀⠀⠀⠀⠀⠀⠀⠀⠀⠀⠀⠀⠀⠀│ 
│            │⠀⠀⠀⠀⠀⠀⠀⠀⠀⠀⠀⠀⠀⠀⠀⠀⠀⠀⠀⠀⠀⠀⠀⠀⠀⠀⠀⠀⠀⠀⠀⠀⠀⠀⠀⠀⠀⠀⠀⠀│ 
│            │⠀⠀⠀⠀⠀⠀⠀⠀⠀⠀⠀⠀⠀⠀⠀⠀⠀⠀⠀⠀⠀⠀⠀⠀⠀⠀⠀⠀⠀⠀⠀⠀⠀⠀⢀⣠⡔⢺⠁⠀│ 
│            │⠀⠀⠀⠀⠀⠀⠀⠀⠀⠀⠀⠀⠀⠀⠀⠀⠀⠀⠀⠀⠀⠀⠀⠀⠀⠀⠀⠀⠀⠀⣀⠤⠒⢉⠕⠁⢸⠀⡽⠀│ 
│            │⠀⠀⠀⠀⠀⠀⠀⠀⠀⠀⠀⠀⠀⠀⠀⠀⠀⠀⠀⠀⠀⠀⠀⠀⠀⠀⣀⠤⠒⠉⠀⢀⠔⠁⠀⠀⠈⢾⠀⠀│ 
│            │⠀⠀⠀⠀⠀⠀⠀⠀⠀⠀⠀⠀⠀⠀⠀⠀⠀⠀⠀⠀⠀⠀⣀⠤⠒⠉⠀⠀⠀⢀⠔⠁⠀⠀⣀⡠⠤⢬⠀⠀│ 
│            │⠀⠀⠀⠀⠀⠀⠀⠀⠀⠀⠀⠀⠀⠀⠀⠀⠤⢤⡤⠤⢶⡭⠤⠔⠒⢒⡲⢶⠖⢛⡪⢭⠛⠉⠉⠉⠉⣁⠀⠀│ 
│            │⠀⠀⠀⠀⠀⠀⠀⠀⡀⠀⠀⠀⠀⢀⡠⠔⠊⣁⠤⠒⠁⠀⠀⠀⣠⣊⠴⠓⠉⣁⡀⠀⠉⠒⠔⠒⠉⢸⠀⠀│ 
│            │⡖⠊⠉⠉⠉⠉⢉⠏⠀⢀⡠⠔⠊⠁⠀⠀⠀⠈⠉⠒⣤⢤⣔⢞⣕⡡⠤⠖⠉⠀⠈⢱⠀⠀⠀⠀⠀⡜⠀⠀│ 
│            │⡇⠀⠀⠀⠀⢠⡣⠔⠊⠁⠀⠀⠀⠀⠀⣀⡠⣔⣊⠭⠔⢚⠾⡉⠒⠢⡄⠀⠀⠀⠀⢎⣀⠀⠀⠀⢰⠁⠀⠀│ 
│            │⢱⠀⠀⠀⠀⠀⠀⠀⠀⠀⣀⣠⠤⠖⠛⡏⠉⠀⠀⡠⠔⠁⠀⡇⠀⠀⠸⡀⠀⠀⠀⠀⠀⠉⡆⠀⢸⠀⠀⠀│ 
│            │⠀⡇⠀⠀⠀⢀⣀⠤⠒⠉⠁⠀⠀⠀⠀⢱⠀⡠⠊⠀⠀⠀⠀⡇⠀⠀⠀⠑⠤⣀⠀⠀⠀⠘⠢⠤⡎⠀⠀⠀│ 
│            │⠀⠸⡠⠒⠊⠁⠀⠀⠀⠀⠀⠀⠀⠀⠀⣸⠊⠀⠀⠀⠀⠀⠀⢇⠀⠀⠀⠀⠀⠀⢹⠀⠀⠀⠀⠀⠀⠀⠀⠀│ 
│            │⠀⠀⠀⠀⠀⠀⠀⠀⠀⠀⠀⠀⠀⣠⡪⠊⠀⠀⠀⠀⠀⠀⠀⠘⡄⠀⠀⢀⡠⠔⠚⠀⠀⠀⠀⠀⠀⠀⠀⠀│ 
│          0 │⠀⠀⠀⠀⠀⠀⠀⠀⠀⠀⠀⣠⠞⠁⠀⠀⠀⠀⠀⠀⠀⠀⠀⠀⠱⠔⠊⠁⠀⠀⠀⠀⠀⠀⠀⠀⠀⠀⠀⠀│ 
│            └────────────────────────────────────────┘ 
└            0                                     8000
┌ Info: Iteration 3 took 0.01s, disallowed 3 cycles.
│   plot_tour(cities, value.(tour_matrix)) =
│            ┌────────────────────────────────────────┐ 
│       6000 │⠀⠀⠀⠀⠀⠀⠀⠀⠀⠀⠀⠀⠀⠀⠀⠀⠀⠀⠀⠀⠀⠀⠀⠀⠀⠀⠀⠀⠀⠀⠀⠀⠀⠀⠀⠀⠀⠀⠀⠀│ 
│            │⠀⠀⠀⠀⠀⠀⠀⠀⠀⠀⠀⠀⠀⠀⠀⠀⠀⠀⠀⠀⠀⠀⠀⠀⠀⠀⠀⠀⠀⠀⠀⠀⠀⠀⠀⠀⠀⠀⠀⠀│ 
│            │⠀⠀⠀⠀⠀⠀⠀⠀⠀⠀⠀⠀⠀⠀⠀⠀⠀⠀⠀⠀⠀⠀⠀⠀⠀⠀⠀⠀⠀⠀⠀⠀⠀⠀⠀⠀⡠⢲⠁⠀│ 
│            │⠀⠀⠀⠀⠀⠀⠀⠀⠀⠀⠀⠀⠀⠀⠀⠀⠀⠀⠀⠀⠀⠀⠀⠀⠀⠀⠀⠀⠀⠀⠀⠀⠀⠀⠀⠀⢱⠀⡹⠀│ 
│            │⠀⠀⠀⠀⠀⠀⠀⠀⠀⠀⠀⠀⠀⠀⠀⠀⠀⠀⠀⠀⠀⠀⠀⠀⠀⠀⠀⠀⠀⠀⠀⠀⠀⠀⠀⠀⡜⢸⠀⠀│ 
│            │⠀⠀⠀⠀⠀⠀⠀⠀⠀⠀⠀⠀⠀⠀⠀⠀⠀⠀⠀⠀⠀⠀⠀⠀⠀⠀⠀⠀⠀⠀⠀⠀⠀⠀⠀⡠⠇⢸⠀⠀│ 
│            │⠀⠀⠀⠀⠀⠀⠀⠀⠀⠀⠀⠀⠀⠀⠀⠀⡤⠤⠤⠤⠤⠤⠤⠤⢄⣀⡠⠤⠒⠉⠢⢄⢀⠔⡪⠔⠊⣁⠀⠀│ 
│            │⠀⠀⠀⠀⠀⠀⠀⠀⡀⠀⠀⠀⠀⠀⠀⠀⠘⡄⠀⠀⠀⠀⠀⠀⠀⠀⠀⠀⠀⣀⣠⡪⠝⠛⠔⠒⠉⢸⠀⠀│ 
│            │⡖⠤⡀⠀⠀⠀⢀⠜⢣⠀⠀⠀⠀⠀⠀⠀⠀⠈⠑⠤⡀⠀⣀⡔⠀⠀⡠⣲⡽⠓⠉⢱⠀⠀⠀⠀⠀⡜⠀⠀│ 
│            │⡇⠀⠈⠑⠢⢤⠊⠀⠸⡀⠀⠀⠀⠀⠀⠀⠀⠀⠀⠀⠈⠉⠀⣇⢔⠾⡎⠁⠀⠀⠀⢎⣀⠀⠀⠀⢰⠁⠀⠀│ 
│            │⢱⠀⠀⠀⠀⠀⠀⠀⠀⢇⣀⡠⠤⠒⠊⡇⠀⠀⠀⠀⠀⡠⡲⡏⠁⠀⠸⡀⠀⠀⠀⠀⠀⠉⡆⠀⢸⠀⠀⠀│ 
│            │⠀⡇⠀⠀⠀⠀⠀⠀⠀⠈⠀⠀⠀⠀⠀⢱⠀⠀⢀⣔⠞⠉⠀⡇⠀⠀⠀⠑⠤⣀⠀⠀⠀⠘⠢⠤⡎⠀⠀⠀│ 
│            │⠀⠸⡠⠢⢄⠀⠀⠀⠀⠀⠀⠀⠀⠀⠀⢸⣠⠴⠋⠀⠀⠀⠀⢇⠀⠀⠀⠀⠀⠀⢹⠀⠀⠀⠀⠀⠀⠀⠀⠀│ 
│            │⠀⠀⠀⠀⠀⠉⠢⢄⠀⠀⠀⠀⠀⠀⡠⠚⠁⠀⠀⠀⠀⠀⠀⠘⡄⠀⠀⢀⡠⠔⠚⠀⠀⠀⠀⠀⠀⠀⠀⠀│ 
│          0 │⠀⠀⠀⠀⠀⠀⠀⠀⠉⠒⢄⣀⠔⠉⠀⠀⠀⠀⠀⠀⠀⠀⠀⠀⠱⠔⠊⠁⠀⠀⠀⠀⠀⠀⠀⠀⠀⠀⠀⠀│ 
│            └────────────────────────────────────────┘ 
└            0                                     8000
┌ Info: Iteration 4 took 0.033s, disallowed 4 cycles.
│   plot_tour(cities, value.(tour_matrix)) =
│            ┌────────────────────────────────────────┐ 
│       6000 │⠀⠀⠀⠀⠀⠀⠀⠀⠀⠀⠀⠀⠀⠀⠀⠀⠀⠀⠀⠀⠀⠀⠀⠀⠀⠀⠀⠀⠀⠀⠀⠀⠀⠀⠀⠀⠀⠀⠀⠀│ 
│            │⠀⠀⠀⠀⠀⠀⠀⠀⠀⠀⠀⠀⠀⠀⠀⠀⠀⠀⠀⠀⠀⠀⠀⠀⠀⠀⠀⠀⠀⠀⠀⠀⠀⠀⠀⠀⠀⠀⠀⠀│ 
│            │⠀⠀⠀⠀⠀⠀⠀⠀⠀⠀⠀⠀⠀⠀⠀⠀⠀⠀⠀⠀⠀⠀⠀⠀⠀⠀⠀⠀⠀⠀⠀⠀⠀⠀⠀⢀⡀⢰⠃⠀│ 
│            │⠀⠀⠀⠀⠀⠀⠀⠀⠀⠀⠀⠀⠀⠀⠀⠀⠀⠀⠀⠀⠀⠀⠀⠀⠀⠀⠀⠀⠀⠀⠀⠀⠀⢀⠔⠁⢸⢸⡽⠀│ 
│            │⠀⠀⠀⠀⠀⠀⠀⠀⠀⠀⠀⠀⠀⠀⠀⠀⠀⠀⠀⠀⠀⠀⠀⠀⠀⠀⠀⠀⠀⠀⠀⢀⠔⠁⠀⠀⡸⢸⠀⠀│ 
│            │⠀⠀⠀⠀⠀⠀⠀⠀⠀⠀⠀⠀⠀⠀⠀⠀⠀⠀⠀⠀⠀⠀⠀⠀⠀⠀⠀⠀⠀⢀⠔⠁⠀⠀⠀⠀⠗⢹⠀⠀│ 
│            │⠀⠀⠀⠀⠀⠀⠀⠀⠀⠀⠀⠀⠀⠀⠀⠀⡤⠤⠤⠤⠤⠤⠤⠤⢄⣀⠤⢔⠞⠉⠒⢄⠀⠀⣀⠤⠊⢹⠀⠀│ 
│            │⠀⠀⠀⠀⠀⠀⠀⠀⡀⠀⠀⠀⠀⠀⠀⠀⠘⡄⠀⠀⠀⠀⠀⠀⠀⢀⠔⠁⠀⣀⣀⠤⠛⠛⠤⠤⣀⣀⠀⠀│ 
│            │⡖⠤⡀⠀⠀⠀⢀⠜⢣⠀⠀⠀⠀⠀⠀⠀⡰⠁⠀⠀⠀⠀⣀⣔⠔⠁⢀⡶⠝⠊⠉⢱⠀⠀⠀⠀⠀⡎⠀⠀│ 
│            │⡇⠀⠈⠑⠢⢤⠊⠀⠸⡀⠀⠀⠀⠀⠀⡰⠁⠀⠀⠀⢠⢊⠔⣇⠤⠪⡃⠀⠀⠀⠀⢇⣀⠀⠀⠀⢰⠁⠀⠀│ 
│            │⢱⠀⠀⠀⠀⠀⠀⠀⠀⢇⠀⠀⣀⣀⣀⡇⠀⠀⠀⡴⠕⠁⠀⠀⠀⠀⠱⡀⠀⠀⠀⠀⠀⠉⡆⠀⢸⠀⠀⠀│ 
│            │⠀⡇⠀⠀⠀⠀⠀⠀⠀⠈⠉⠉⠀⠀⠀⠀⠀⣠⠎⠀⠀⠀⠀⠀⠀⠀⠀⠑⠤⣀⠀⠀⠀⠘⠢⠤⡎⠀⠀⠀│ 
│            │⠀⠸⡠⠢⢄⠀⠀⠀⠀⠀⠀⠀⠀⠀⠀⡠⡺⣁⡠⠤⠒⠊⠉⢇⠀⠀⠀⠀⠀⠀⢹⠀⠀⠀⠀⠀⠀⠀⠀⠀│ 
│            │⠀⠀⠀⠀⠀⠉⠢⢄⠀⠀⠀⠀⠀⡠⠊⠈⠉⠀⠀⠀⠀⠀⠀⠈⡆⠀⠀⠀⣀⠤⠚⠀⠀⠀⠀⠀⠀⠀⠀⠀│ 
│          0 │⠀⠀⠀⠀⠀⠀⠀⠀⠉⠒⢄⡠⠊⠀⠀⠀⠀⠀⠀⠀⠀⠀⠀⠀⠸⠤⠒⠉⠀⠀⠀⠀⠀⠀⠀⠀⠀⠀⠀⠀│ 
│            └────────────────────────────────────────┘ 
└            0                                     8000
┌ Info: Iteration 5 took 0.044s, disallowed 2 cycles.
│   plot_tour(cities, value.(tour_matrix)) =
│            ┌────────────────────────────────────────┐ 
│       6000 │⠀⠀⠀⠀⠀⠀⠀⠀⠀⠀⠀⠀⠀⠀⠀⠀⠀⠀⠀⠀⠀⠀⠀⠀⠀⠀⠀⠀⠀⠀⠀⠀⠀⠀⠀⠀⠀⠀⠀⠀│ 
│            │⠀⠀⠀⠀⠀⠀⠀⠀⠀⠀⠀⠀⠀⠀⠀⠀⠀⠀⠀⠀⠀⠀⠀⠀⠀⠀⠀⠀⠀⠀⠀⠀⠀⠀⠀⠀⠀⠀⠀⠀│ 
│            │⠀⠀⠀⠀⠀⠀⠀⠀⠀⠀⠀⠀⠀⠀⠀⠀⠀⠀⠀⠀⠀⠀⠀⠀⠀⠀⠀⠀⠀⠀⠀⠀⠀⠀⠀⠀⡠⢺⠁⠀│ 
│            │⠀⠀⠀⠀⠀⠀⠀⠀⠀⠀⠀⠀⠀⠀⠀⠀⠀⠀⠀⠀⠀⠀⠀⠀⠀⠀⠀⠀⠀⠀⠀⠀⠀⠀⠀⠀⢸⠀⡽⠀│ 
│            │⠀⠀⠀⠀⠀⠀⠀⠀⠀⠀⠀⠀⠀⠀⠀⠀⠀⠀⠀⠀⠀⠀⠀⠀⠀⠀⠀⠀⠀⠀⠀⠀⠀⠀⠀⠀⡸⢸⠀⠀│ 
│            │⠀⠀⠀⠀⠀⠀⠀⠀⠀⠀⠀⠀⠀⠀⠀⠀⠀⠀⠀⠀⠀⠀⠀⠀⠀⠀⠀⠀⠀⠀⠀⠀⠀⠀⠀⢀⠇⡸⠀⠀│ 
│            │⠀⠀⠀⠀⠀⠀⠀⠀⠀⠀⠀⠀⠀⠀⠀⠀⡤⠤⠤⠤⠤⠤⠤⠤⢄⣀⠤⠔⠊⠉⠒⢄⠀⠀⢀⠎⠀⢇⠀⠀│ 
│            │⠀⠀⠀⠀⠀⠀⠀⠀⡀⠀⠀⠀⠀⠀⠀⠀⠘⡄⠀⠀⠀⠀⠀⠀⠀⠀⠀⠀⠀⣀⡀⠀⠉⠒⠎⠀⠀⢸⠀⠀│ 
│            │⡖⠤⡀⠀⠀⠀⢀⠜⢣⠀⠀⠀⠀⠀⠀⠀⡰⠁⠀⠀⠀⠀⣀⠴⡀⠀⢀⠖⠉⠀⠈⢱⠀⠀⠀⠀⠀⡎⠀⠀│ 
│            │⡇⠀⠈⠑⠢⢤⠊⠀⠸⡀⠀⠀⠀⠀⠀⡰⠁⠀⠀⠀⠀⠈⠢⡀⠈⠢⠃⠀⠀⠀⠀⢇⣀⠀⠀⠀⢰⠁⠀⠀│ 
│            │⢱⠀⠀⠀⠀⠀⠀⠀⠀⢇⠀⠀⣀⣀⣀⡇⠀⠀⠀⠀⠀⠀⠀⡇⠀⠀⠀⠀⠀⠀⠀⠀⠀⠉⡆⠀⢸⠀⠀⠀│ 
│            │⠀⡇⠀⠀⠀⠀⠀⠀⠀⠈⠉⠉⠀⠀⠀⠀⠀⠀⠀⠀⠀⠀⠀⣇⣀⡠⠤⠒⡄⠀⠀⠀⠀⠘⠢⠤⡎⠀⠀⠀│ 
│            │⠀⠸⡠⠢⢄⠀⠀⠀⠀⠀⠀⠀⠀⠀⠀⠀⢀⣀⡠⠤⠒⠒⠉⢇⠀⢀⣀⠤⠬⢲⢺⠀⠀⠀⠀⠀⠀⠀⠀⠀│ 
│            │⠀⠀⠀⠀⠀⠉⠢⢄⠀⠀⠀⠀⠀⠀⠀⠈⠑⠒⢤⣄⣤⠤⠒⠚⡍⠁⠀⠀⠀⠀⠙⠀⠀⠀⠀⠀⠀⠀⠀⠀│ 
│          0 │⠀⠀⠀⠀⠀⠀⠀⠀⠉⠒⢄⣀⣀⠤⠤⠒⠊⠉⠁⠀⠀⠉⠑⠒⠵⠀⠀⠀⠀⠀⠀⠀⠀⠀⠀⠀⠀⠀⠀⠀│ 
│            └────────────────────────────────────────┘ 
└            0                                     8000
┌ Info: Iteration 6 took 0.048s, disallowed 2 cycles.
│   plot_tour(cities, value.(tour_matrix)) =
│            ┌────────────────────────────────────────┐ 
│       6000 │⠀⠀⠀⠀⠀⠀⠀⠀⠀⠀⠀⠀⠀⠀⠀⠀⠀⠀⠀⠀⠀⠀⠀⠀⠀⠀⠀⠀⠀⠀⠀⠀⠀⠀⠀⠀⠀⠀⠀⠀│ 
│            │⠀⠀⠀⠀⠀⠀⠀⠀⠀⠀⠀⠀⠀⠀⠀⠀⠀⠀⠀⠀⠀⠀⠀⠀⠀⠀⠀⠀⠀⠀⠀⠀⠀⠀⠀⠀⠀⠀⠀⠀│ 
│            │⠀⠀⠀⠀⠀⠀⠀⠀⠀⠀⠀⠀⠀⠀⠀⠀⠀⠀⠀⠀⠀⠀⠀⠀⠀⠀⠀⠀⠀⠀⠀⠀⠀⠀⠀⠀⡠⢲⠁⠀│ 
│            │⠀⠀⠀⠀⠀⠀⠀⠀⠀⠀⠀⠀⠀⠀⠀⠀⠀⠀⠀⠀⠀⠀⠀⠀⠀⠀⠀⠀⠀⠀⠀⠀⠀⠀⠀⠀⢱⠀⡹⠀│ 
│            │⠀⠀⠀⠀⠀⠀⠀⠀⠀⠀⠀⠀⠀⠀⠀⠀⠀⠀⠀⠀⠀⠀⠀⠀⠀⠀⠀⠀⠀⠀⠀⠀⠀⠀⠀⠀⡜⢸⠀⠀│ 
│            │⠀⠀⠀⠀⠀⠀⠀⠀⠀⠀⠀⠀⠀⠀⠀⠀⠀⠀⠀⠀⠀⠀⠀⠀⠀⠀⠀⠀⠀⠀⠀⠀⠀⠀⠀⢀⠇⢸⠀⠀│ 
│            │⠀⠀⠀⠀⠀⠀⠀⠀⠀⠀⠀⠀⠀⠀⠀⠀⡤⠤⠤⠤⠤⠤⢄⠀⠀⢀⡠⠤⠒⠉⠢⢄⠀⠀⢀⠎⠀⢇⠀⠀│ 
│            │⠀⠀⠀⠀⠀⠀⠀⠀⡀⠀⠀⠀⠀⠀⠀⠀⠘⡄⠀⠀⠀⠀⠘⡄⡠⠃⠀⠀⠀⣀⡀⠀⠉⠒⠎⠀⠀⢸⠀⠀│ 
│            │⡖⠤⡀⠀⠀⠀⢀⠜⢣⠀⠀⠀⠀⠀⠀⠀⡰⠁⠀⠀⠀⠀⣠⠟⠀⠀⡠⠒⠉⠀⠈⢱⠀⠀⠀⠀⠀⡜⠀⠀│ 
│            │⡇⠀⠈⠑⠢⢤⠊⠀⠸⡀⠀⠀⠀⠀⠀⡰⠁⠀⠀⠀⡠⠊⠢⣀⡴⠮⡀⠀⠀⠀⠀⢎⣀⠀⠀⠀⢰⠁⠀⠀│ 
│            │⢱⠀⠀⠀⠀⠀⠀⠀⠀⢇⠀⠀⣀⣀⣀⡇⠀⠀⢀⠔⠁⡠⠒⠁⠀⠀⠱⡀⠀⠀⠀⠀⠀⠉⡆⠀⢸⠀⠀⠀│ 
│            │⠀⡇⠀⠀⠀⠀⠀⠀⠀⠈⠉⠉⠀⠀⠀⠀⢀⠔⢁⠔⠊⠀⠀⠀⠀⠀⠀⠑⠤⣀⠀⠀⠀⠘⠢⠤⡎⠀⠀⠀│ 
│            │⠀⠸⡠⠢⢄⠀⠀⠀⠀⠀⠀⠀⠀⠀⠀⡔⡡⣔⡡⠤⠒⠊⠉⢇⠀⠀⠀⠀⠀⠀⢹⠀⠀⠀⠀⠀⠀⠀⠀⠀│ 
│            │⠀⠀⠀⠀⠀⠉⠢⢄⠀⠀⠀⠀⠀⡠⠊⠈⠉⠀⠀⠀⠀⠀⠀⠈⡆⠀⠀⠀⣀⠤⠚⠀⠀⠀⠀⠀⠀⠀⠀⠀│ 
│          0 │⠀⠀⠀⠀⠀⠀⠀⠀⠉⠒⢄⡠⠊⠀⠀⠀⠀⠀⠀⠀⠀⠀⠀⠀⠸⠤⠒⠉⠀⠀⠀⠀⠀⠀⠀⠀⠀⠀⠀⠀│ 
│            └────────────────────────────────────────┘ 
└            0                                     8000
┌ Info: Iteration 7 took 0.056s, disallowed 1 cycles.
│   plot_tour(cities, value.(tour_matrix)) =
│            ┌────────────────────────────────────────┐ 
│       6000 │⠀⠀⠀⠀⠀⠀⠀⠀⠀⠀⠀⠀⠀⠀⠀⠀⠀⠀⠀⠀⠀⠀⠀⠀⠀⠀⠀⠀⠀⠀⠀⠀⠀⠀⠀⠀⠀⠀⠀⠀│ 
│            │⠀⠀⠀⠀⠀⠀⠀⠀⠀⠀⠀⠀⠀⠀⠀⠀⠀⠀⠀⠀⠀⠀⠀⠀⠀⠀⠀⠀⠀⠀⠀⠀⠀⠀⠀⠀⠀⠀⠀⠀│ 
│            │⠀⠀⠀⠀⠀⠀⠀⠀⠀⠀⠀⠀⠀⠀⠀⠀⠀⠀⠀⠀⠀⠀⠀⠀⠀⠀⠀⠀⠀⠀⠀⠀⠀⠀⠀⠀⡠⢺⠁⠀│ 
│            │⠀⠀⠀⠀⠀⠀⠀⠀⠀⠀⠀⠀⠀⠀⠀⠀⠀⠀⠀⠀⠀⠀⠀⠀⠀⠀⠀⠀⠀⠀⠀⠀⠀⠀⠀⠀⢸⠀⡽⠀│ 
│            │⠀⠀⠀⠀⠀⠀⠀⠀⠀⠀⠀⠀⠀⠀⠀⠀⠀⠀⠀⠀⠀⠀⠀⠀⠀⠀⠀⠀⠀⠀⠀⠀⠀⠀⠀⠀⡸⢸⠀⠀│ 
│            │⠀⠀⠀⠀⠀⠀⠀⠀⠀⠀⠀⠀⠀⠀⠀⠀⠀⠀⠀⠀⠀⠀⠀⠀⠀⠀⠀⠀⠀⠀⠀⠀⠀⠀⠀⢀⠇⡸⠀⠀│ 
│            │⠀⠀⠀⠀⠀⠀⠀⠀⠀⠀⠀⠀⠀⠀⠀⠀⡤⠤⠤⠤⠤⠤⠤⠤⢄⣀⠤⠔⠊⠉⠒⢄⠀⠀⢀⠎⠀⢇⠀⠀│ 
│            │⠀⠀⠀⠀⠀⠀⠀⠀⡀⠀⠀⠀⠀⠀⠀⠀⠘⡄⠀⠀⠀⠀⠀⠀⠀⠀⠀⠀⠀⣀⡀⠀⠉⠒⠎⠀⠀⢸⠀⠀│ 
│            │⡖⠤⡀⠀⠀⠀⢀⠜⢣⠀⠀⠀⠀⠀⠀⠀⡰⠁⠀⠀⠀⠀⣀⠔⠒⠒⠒⠒⠉⠀⠈⢱⠀⠀⠀⠀⠀⡎⠀⠀│ 
│            │⡇⠀⠈⠑⠢⢤⠊⠀⠸⡀⠀⠀⠀⠀⠀⡰⠁⠀⠀⠀⠀⠈⠢⣀⡠⠤⡀⠀⠀⠀⠀⢇⣀⠀⠀⠀⢰⠁⠀⠀│ 
│            │⢱⠀⠀⠀⠀⠀⠀⠀⠀⢇⠀⠀⣀⣀⣀⡇⠀⠀⠀⠀⠀⠀⠀⠀⠀⠀⠱⡀⠀⠀⠀⠀⠀⠉⡆⠀⢸⠀⠀⠀│ 
│            │⠀⡇⠀⠀⠀⠀⠀⠀⠀⠈⠉⠉⠀⠀⠀⠀⠀⠀⠀⠀⠀⠀⠀⠀⠀⠀⠀⠑⠤⣀⠀⠀⠀⠘⠢⠤⡎⠀⠀⠀│ 
│            │⠀⠸⡠⠢⢄⠀⠀⠀⠀⠀⠀⠀⠀⠀⠀⠀⠀⣀⡠⠤⠒⠊⠉⢇⠀⠀⠀⠀⠀⠀⢹⠀⠀⠀⠀⠀⠀⠀⠀⠀│ 
│            │⠀⠀⠀⠀⠀⠉⠢⢄⠀⠀⠀⠀⠀⢀⠤⠊⠉⠀⠀⠀⠀⠀⠀⠈⡆⠀⠀⠀⣀⠤⠚⠀⠀⠀⠀⠀⠀⠀⠀⠀│ 
│          0 │⠀⠀⠀⠀⠀⠀⠀⠀⠉⠒⢄⡠⠒⠁⠀⠀⠀⠀⠀⠀⠀⠀⠀⠀⠸⠤⠒⠉⠀⠀⠀⠀⠀⠀⠀⠀⠀⠀⠀⠀│ 
│            └────────────────────────────────────────┘ 
└            0                                     8000
[ Info: Optimization finished; adaptively disallowed 22 cycles.
[ Info: Final path has length 10628.0.
┌ Error: Exception while generating log record in module TravelingSalesmanExact at /root/.julia/packages/TravelingSalesmanExact/7TcDo/src/TravelingSalesmanExact.jl:235
│   exception =
│    type Model has no field variable_to_zero_one
│    Stacktrace:
│     [1] getproperty(::JuMP.Model, ::Symbol) at ./Base.jl:33
│     [2] macro expansion at ./logging.jl:320 [inlined]
│     [3] _get_optimal_tour(::Array{Int64,2}, ::JuMP.OptimizerFactory, ::Bool, ::Bool, ::Array{Any,1}) at /root/.julia/packages/TravelingSalesmanExact/7TcDo/src/TravelingSalesmanExact.jl:235
│     [4] get_optimal_tour(::Array{Any,1}, ::JuMP.OptimizerFactory; verbose::Bool, distance::typeof(TravelingSalesmanExact.ATT), symmetric::Bool) at /root/.julia/packages/TravelingSalesmanExact/7TcDo/src/TravelingSalesmanExact.jl:153
│     [5] test_tour(::Array{Any,1}, ::JuMP.OptimizerFactory; kwargs::Base.Iterators.Pairs{Symbol,Any,Tuple{Symbol,Symbol},NamedTuple{(:distance, :verbose),Tuple{typeof(TravelingSalesmanExact.ATT),Bool}}}) at /root/.julia/packages/TravelingSalesmanExact/7TcDo/test/runtests.jl:28
│     [6] macro expansion at /root/.julia/packages/TravelingSalesmanExact/7TcDo/test/runtests.jl:40 [inlined]
│     [7] macro expansion at /buildworker/worker/package_linux64/build/usr/share/julia/stdlib/v1.4/Test/src/Test.jl:1110 [inlined]
│     [8] top-level scope at /root/.julia/packages/TravelingSalesmanExact/7TcDo/test/runtests.jl:39
│     [9] include(::String) at ./client.jl:439
│     [10] top-level scope at none:6
│     [11] eval(::Module, ::Any) at ./boot.jl:331
│     [12] exec_options(::Base.JLOptions) at ./client.jl:264
│     [13] _start() at ./client.jl:484
└ @ TravelingSalesmanExact ~/.julia/packages/TravelingSalesmanExact/7TcDo/src/TravelingSalesmanExact.jl:235
Test Summary: | Pass  Total
att48.tsp     |   10     10
[ Info: Starting optimization.
[ Info: Iteration 1 took 0.001s, disallowed 1 cycles.
[ Info: Optimization finished; adaptively disallowed 0 cycles.
[ Info: Final path has length 20.986832.
┌ Error: Exception while generating log record in module TravelingSalesmanExact at /root/.julia/packages/TravelingSalesmanExact/7TcDo/src/TravelingSalesmanExact.jl:235
│   exception =
│    type Model has no field variable_to_zero_one
│    Stacktrace:
│     [1] getproperty(::JuMP.Model, ::Symbol) at ./Base.jl:33
│     [2] macro expansion at ./logging.jl:320 [inlined]
│     [3] _get_optimal_tour(::Array{Float64,2}, ::JuMP.OptimizerFactory, ::Bool, ::Bool, ::Nothing) at /root/.julia/packages/TravelingSalesmanExact/7TcDo/src/TravelingSalesmanExact.jl:235
│     [4] _get_optimal_tour at /root/.julia/packages/TravelingSalesmanExact/7TcDo/src/TravelingSalesmanExact.jl:175 [inlined]
│     [5] #get_optimal_tour#10 at /root/.julia/packages/TravelingSalesmanExact/7TcDo/src/TravelingSalesmanExact.jl:171 [inlined]
│     [6] test_tour(::Array{Float64,2}, ::JuMP.OptimizerFactory; kwargs::Base.Iterators.Pairs{Symbol,Bool,Tuple{Symbol},NamedTuple{(:verbose,),Tuple{Bool}}}) at /root/.julia/packages/TravelingSalesmanExact/7TcDo/test/runtests.jl:28
│     [7] macro expansion at /root/.julia/packages/TravelingSalesmanExact/7TcDo/test/runtests.jl:50 [inlined]
│     [8] macro expansion at /buildworker/worker/package_linux64/build/usr/share/julia/stdlib/v1.4/Test/src/Test.jl:1110 [inlined]
│     [9] top-level scope at /root/.julia/packages/TravelingSalesmanExact/7TcDo/test/runtests.jl:49
│     [10] include(::String) at ./client.jl:439
│     [11] top-level scope at none:6
│     [12] eval(::Module, ::Any) at ./boot.jl:331
│     [13] exec_options(::Base.JLOptions) at ./client.jl:264
│     [14] _start() at ./client.jl:484
└ @ TravelingSalesmanExact ~/.julia/packages/TravelingSalesmanExact/7TcDo/src/TravelingSalesmanExact.jl:235
Test Summary:           | Pass  Total
Small random asymmetric |   14     14
Test Summary:          | Pass  Total
Small random symmetric |   14     14
Test Summary:       | Pass  Total
Small random cities |   20     20
Test Summary: | Pass  Total
Exceptions    |    2      2
   Testing TravelingSalesmanExact tests passed 
